http://freedomsphoenix.com/Radio-TV-Archives.htm?EdNo=220
HTTP/1.1 200 OK
Date: Thu, 24 Jul 2014 14:44:35 GMT
Server: Apache
X-Powered-By: PHP/5.4.28
Set-Cookie: PHPSESSID=3c98556f23c3dc30c6f0e1d7ebc7b6d5; path=/
Expires: Thu, 19 Nov 1981 08:52:00 GMT
Cache-Control: no-store, no-cache, must-revalidate, post-check=0, pre-check=0
Pragma: no-cache
Connection: close
Content-Type: text/html; charset=Windows-1252

<center><b><font face="Arial" size="1" color="#CCCCCC">Time to connect to database: 0.000004 Seconds</font></b><br></center><html>

<head>

<meta http-equiv="Content-Language" content="en-us">
<meta http-equiv="Content-Type" content="text/html; charset=windows-1252">
<meta name="news_keywords" content=""/>
<meta name="PageDescription" content="">

<!-- OpenWYSIWYG Editor -->
<script language="JavaScript" type="text/javascript" src="/openwysiwyg/scripts/wysiwyg.js"></script> 
<script language="JavaScript" type="text/javascript" src="/openwysiwyg/scripts/wysiwyg-settings.js"></script>

<title></title>
<script type="text/javascript">
var gaJsHost = (("https:" == document.location.protocol) ? "http://ssl." : "http://www.");
document.write(unescape("%3Cscript src='" + gaJsHost + "google-analytics.com/ga.js' type='text/javascript'%3E%3C/script%3E"));
</script>
<script type="text/javascript">
try {
var pageTracker = _gat._getTracker("UA-9154649-1");
pageTracker._trackPageview();
} catch(err) {}
</script>

</head>

<body topmargin="0" bgcolor="#002595">
	<center>
	<table border="0" width="960" cellpadding="0" cellspacing="0" style="border-collapse: collapse" bordercolor="#111111">
		<tr>
            <td width="160" align="center" bgcolor="#000000" height="26">
			<b><a title="View Global Edition of Freedom's Phoenix" href="http://www.FreedomsPhoenix.com/Front-Page.htm?EdNo=001">
			<font face="Arial" size="2" color="#0000FF">Global Edition</font></a></b></td>
            <td width="640" align="center" bgcolor="#000000"height="26">
			<b><font face="Arial" size="4" color="#0000FF">Freedom's Phoenix -- Arizona Sky Watch Edition</font></b></td>
            <td width="160" align="center" bgcolor="#000000" height="26">
			<b><font face="Arial" size="4" color="#0000FF"></font></b></td>
        </tr>
		<tr>
            <td width="960" align="center" bgcolor="#000000" valign="top" colspan="3">
<a title="Freedom's Phoenix: Uncovering the Secrets &amp; Exposing the Lies" href="http://www.FreedomsPhoenix.com/Front-Page.htm?EdNo=220">
<img border="0" src="http://www.FreedomsPhoenix.com/images/Editions/" alt="Freedom's Phoenix: Uncovering the Secrets &amp; Exposing the Lies"> </a>
			</td>
        </tr>
	</table>
	</center>
	<center>
	<table border="0" cellpadding="0" cellspacing="0" width="1000" style="border-top-width: 0; border-collapse:collapse" bgcolor="#FFFFFF">
		<tr>
            <td bgcolor="#FFFFFF" width="18" height="90">
			&nbsp;</td>
            <td bgcolor="#FFFFFF" width="220" height="90">
	<center>
	<table border="1" cellpadding="0" cellspacing="0" style="border-collapse: collapse" bordercolor="#111111" width="220">
		<tr>
			<td width="220" height="90" align="center" valign="top" bgcolor="#000000">
			<a target="_blank" href="http://rrbi.co/">
			<img border="0" src="../images/Gold-Silver-Price-Ticker-Banner-260x70.png" width="220" height="56"></a><br>
			<b><font face="arial" color="#F3E683" style="font-size: 9pt">Gold: $1290.80&nbsp; Change: $-13.80<br>
			</font><font face="arial" color="#FFFFFF" style="font-size: 9pt">Silver: $20.56&nbsp; Change: $-0.35</font><br>
<!--			<font face="arial" color="#F3E683" style="font-size: 8pt">Bitcoin � Hi: $133.35&nbsp;Lo: $133.35&nbsp;Av: $133.35 -->
			</font></b></td>
		</tr>
	</table>
	</center>			</td>
            <td align="center" bgcolor="#FFFFFF" width="10" height="90">
			&nbsp;</td>
            <td align="center" bgcolor="#FFFFFF" width="728" height="90">
<a href="http://www.FreedomsPhoenix.com/SendTo.htm?AdNo=1245&EdNo=220" target="_blank"><img src="_Ads/Graphics/Agorist-Alma-003.jpg" width="728" height="90" border="0" alt="Agorist Marketplace"></a>			</td>
            <td align="center" bgcolor="#FFFFFF" width="24" height="90">
			&nbsp;</td>
        </tr>
		<tr>
            <td width="18" bgcolor="#FFFFFF">
			<img border="0" src="http://www.FreedomsPhoenix.com/images/space.gif" width="18" height="10"></td>
            <td align="center" width="220" valign="top" bgcolor="#FFFFFF">
			<img border="0" src="../images/space.gif" width="220" height="10"></td>
            <td width="10" bgcolor="#FFFFFF">
			<img border="0" src="../images/space.gif" width="10" height="10"></td>
            <td align="center" width="740" bgcolor="#FFFFFF">
			<img border="0" src="../images/space.gif" width="728" height="10"></td>
            <td width="24" bgcolor="#FFFFFF">
			<img border="0" src="http://www.FreedomsPhoenix.com/images/space.gif" width="24" height="10"></td>
        </tr>
	</table>
	</center>
	

	<center>
	<table border="0" width="1000" cellspacing="0" cellpadding="0" style="border-collapse: collapse" bordercolor="#111111">
		<tr>
            <td width="18" bgcolor="#FFFFFF">
			<img border="0" src="http://www.FreedomsPhoenix.com/images/space.gif" width="18" height="10"></td>
            <td align="center" width="182" bgcolor="#000000" valign="top">
	<center>
	<table border="0" cellpadding="0" cellspacing="0" style="border-collapse: collapse" bordercolor="#111111" width="180">
		<tr>
			<td align="center" bgcolor="#3234CD" height="70" width="70" colspan="2" style="border-bottom-style: none; border-bottom-width: medium">
			<font color="#FFEC9F">
			<img border="0" src="http://www.freedomsphoenix.com/images/Bitcoin-Logo-60x60.png" width="60" height="60" align="left" hspace="5" vspace="5"></font></td>
			<td align="center" bgcolor="#3234CD" height="70" width="110" style="border-bottom-style: none; border-bottom-width: medium">
			<font color="#FFEC9F"><b><font size="1" face="Arial">Current Bitcoin <br>
			Price: </font><font size="2" face="Arial">$602.9009</font></b>
			<font size="1" face="Arial"><br>Provided by <br>BitPay.com</font></font></td>
		</tr>
	</table>
	<table border="0" cellpadding="0" cellspacing="0" style="border-collapse: collapse" bordercolor="#111111" width="180">
		<tr>
			<td align="center" bgcolor="#EBF5FA" height="60" width="180" colspan="3">
			<font face="Arial"><font size="1">&nbsp;</font><br>
			<font color="#3234CD"><b>Contribute Bitcoin to<br>
			Freedom's Phoenix</b></font><font size="1"><br>
			</font></font>
			<img border="0" src="http://www.FreedomsPhoenix.com/images/FreedomsPhoenix-QRCode.jpg" hspace="10" vspace="10" width="100" height="100"><br>
			<input type="text" name="FPBitcoinCode" size="26" value="12wr6DRVYaNkBpfegzFPaepZxRDZ9QTyS8" style="font-family: Arial; font-size: 8pt; border: 1px solid #3234CD; padding-left:2; padding-right:0; padding-top:0; padding-bottom:0" maxlength="500"><br>
			<font face="Arial" size="1">Scan the QR Code above, or <br>
			double-click on the text in the <br>
			box, copy it, and paste it into your<br>
			Bitcoin payment application.<br>
			</font><b><font face="Arial" size="2"><a target="_blank" href="https://www.freedomsphoenix.com/Secure/Contributions.htm?EdNo=001"><font color="#3234CD">Contribute Funding by</font></a></font><font face="Arial" size="4"> </font><font face="Arial" size="2"><br>
			<a target="_blank" href="https://www.freedomsphoenix.com/Secure/Contributions.htm?EdNo=001"><font color="#3234CD">PayPal or Credit Card</font></a></font></b><br>
			<font size="1">&nbsp;</font>
			</td>
		</tr>
		<tr>
			<td align="center" bgcolor="#CC3300" height="60" width="180" colspan="3" style="border-style: solid; border-width: 1"><b><font color="#3234CD" face="Arial" size="4"><a href="https://www.FreedomsPhoenix.com/Secure/Join-Us.htm?EdNo=220&AddFrom=RedBox"><font color="#FFFF99">Sign-up for FREE<br>
			Daily Newsletter</font></a></font></b></td>
		</tr>
		<tr>
			<td align="center" bgcolor="#FFFF99" height="30" width="180" colspan="3"><b><font face="Arial" size="2">
			<a href="https://www.FreedomsPhoenix.com/Secure/Log-In.htm"><font color="#3234CD">Log-In</font></a></font></b></td>
		</tr>
		<tr>
			<td align="center" bgcolor="#FFFFFF" width="180" colspan="3" style="border-top-style: none; border-top-width: medium" height="30">
			<p><b><a href="#Menu"><font face="Arial" color="#CC3300">See Complete Menu</font></a></b></p>
			</td>
		</tr>
		<tr>
			<td align="center" bgcolor="#E2EAFE" width="180" colspan="3" style="border-top-style: none; border-top-width: medium" height="32">
			<b><font face="Arial"><a title="List of Special Editions" href="http://www.freedomsphoenix.com/Radio-TV-Archives.htm?Menu=Spec"><font color="#3234CD">Special Editions</font></a></font></b></td>
		</tr>
		<tr>
			<td align="center" bgcolor="#E2EAFE" width="180" colspan="3" height="30">
			<b><font face="Arial"><a title="List of Translation Languages" href="http://www.freedomsphoenix.com/Radio-TV-Archives.htm?Menu=Tran"><font color="#3234CD">Translate Page</font></a></font></b></td>
		</tr>
		<tr>
			<td align="center" bgcolor="#E2EAFE" width="180" colspan="3" height="30">
			<b><font face="Arial"><a title="RSS Feeds" href="http://www.freedomsphoenix.com/Radio-TV-Archives.htm?Menu=Feed"><font color="#3234CD">RSS Feeds</font></a></font></b></td>
		</tr>
		<tr>
			<td align="center" bgcolor="#E2EAFE" width="180" colspan="3" style="border-top-style: none; border-top-width: medium">
			<b><font face="Arial" color="#3234CD" size="1">&nbsp;</font></b></td>
		</tr>
		<tr>
			<td align="center" bgcolor="#FFFFFF" width="180" colspan="3" height="150" style="border-style: solid; border-width: 1">
			<p style="line-height: 12pt">
			<a href="http://www.freedomsphoenix.com/Program-Page.htm?No=0001"><img border="0" src="http://www.FreedomsPhoenix.com/images/Media-Logos/Pix/DYIwEH-Radio-Show-Pix.jpg" width="111" height="80"></a><br>
			<b><a href="http://www.freedomsphoenix.com/Program-Page.htm?No=0001"><font color="#CC3300" face="Arial" size="4">Declare Your <br>
			Independence</font></a><font face="Arial" size="2" color="#3234CD"><br>
			with Ernest Hancock</font></b></td>
		</tr>
		<tr>
			<td align="center" bgcolor="#E2EAFE" width="180" colspan="3"><font size="1">&nbsp;</font></td>
		</tr>
		<tr>
			<td align="center" bgcolor="#FFFF99" height="30" width="180" colspan="3"><b><font face="Arial" size="2">
			<a href="https://www.FreedomsPhoenix.com/Secure/Log-In.htm"><font color="#3234CD">Log-In</font></a></font></b></td>
		</tr>
		<tr>
			<td align="center" bgcolor="#E2EAFE" height="30" width="180" colspan="3"><b><font face="Arial"><a href="http://www.FreedomsPhoenix.com/Front-Page.htm?EdNo=220"><font color="#3234CD">Front Page</font></a></font></b></td>
		</tr>
		<tr>
			<td align="center" bgcolor="#E2EAFE" height="24" width="180" colspan="3"><b><font face="Arial" size="2"><a href="http://www.FreedomsPhoenix.com/Page-Two.htm?EdNo=220"><font color="#3234CD">Page Two</font></a></font></b></td>
		</tr>
		<tr>
			<td align="center" bgcolor="#E2EAFE" height="50" width="180" colspan="3"><a href="http://www.FreedomsPhoenix.com/Market/Marketplace.htm"><img border="0" src="http://www.FreedomsPhoenix.com/images/Marketplace-Link-Button-180x30.jpg" width="180" height="30"></a></td>
		</tr>
		<tr>
			<td align="center" bgcolor="#E2EAFE" height="50" width="180" colspan="3"><a href="http://www.FreedomsPhoenix.com/Funding/Funding-Center.htm"><img border="0" src="http://www.FreedomsPhoenix.com/images/Funding-Center-Link-Button-180x30.jpg" width="180" height="30"></a></td>
		</tr>
		<tr>
			<td align="center" bgcolor="#E2EAFE" width="180" colspan="3"><font size="1">&nbsp;</font></td>
		</tr>
		<tr>
			<td align="center" bgcolor="#FFFFFF" height="50" width="180" colspan="3" style="border-style:solid; border-width:1; ">
			<font size="1">&nbsp;</font><br>
			<a href="http://www.freedomsphoenix.com/Magazine/Issue-List.htm">
			<img border="0" src="http://www.FreedomsPhoenix.com/images/X-Menu-Mag-Cover.jpg" width="75" height="100"></a><br>
			<b><font face="Arial"><a href="http://www.freedomsphoenix.com/Magazine/Issue-List.htm"><font color="#CC3300">Freedom's Phoenix<br>
			Online Magazine</font></a></font></b><br>
			<font size="1">&nbsp;</font></td>
		</tr>
		<tr>
			<td align="center" bgcolor="#E2EAFE" height="24" width="180" colspan="3" style="border-top-style: solid; border-top-width: 1"><b><font face="Arial" size="2"><a href="http://www.FreedomsPhoenix.com/Forum-List.htm?EdNo=220"><font color="#3234CD">Freedom Forum</font></a></font></b></td>
		</tr>
		<tr>
			<td align="center" bgcolor="#E2EAFE" height="24" width="180" colspan="3"><b><font face="Arial" size="2"><a href="http://www.FreedomsPhoenix.com/List-of-Letters.htm?EdNo=220"><font color="#3234CD">Letters to the Editor</font></a></font></b></td>
		</tr>
		<tr>
			<td align="center" bgcolor="#E2EAFE" height="24" width="180" colspan="3"><b><font face="Arial" size="2"><a href="http://www.FreedomsPhoenix.com/Report-the-News.htm?EdNo=220"><font color="#3234CD">Report The News</font></a></font></b></td>
		</tr>
		<tr>
			<td align="center" bgcolor="#E2EAFE" height="24" width="20"><b><font face="Arial" size="2">&nbsp;</font></b></td>
			<td align="center" bgcolor="#E2EAFE" height="24" width="160" colspan="2" valign="bottom">
			<p align="left"><i><b><font face="Arial">Anarchives:</font></b></i></td>
		</tr>
		<tr>
			<td align="center" bgcolor="#E2EAFE" height="24" width="20">
			<p align="left">&nbsp;</td>
			<td align="center" bgcolor="#E2EAFE" height="24" width="20">
			&nbsp;</td>
			<td align="center" bgcolor="#E2EAFE" height="24" width="140" valign="bottom">
			<p align="left"><b><font face="Arial" style="font-size: 9pt"><a href="http://www.FreedomsPhoenix.com/Search-Page.htm?EdNo=220"><font color="#3234CD">Search by Keyword</font></a></font></b></td>
		</tr>
		<tr>
			<td align="left" bgcolor="#E2EAFE" height="24" width="20">&nbsp;</td>
			<td align="left" bgcolor="#E2EAFE" height="24" width="20">&nbsp;</td>
			<td align="left" bgcolor="#E2EAFE" height="24" width="140" valign="bottom"><b><font face="Arial" style="font-size: 9pt"><a href="http://www.FreedomsPhoenix.com/Contents-List.htm?EdNo=220"><font color="#3234CD">Contents by Subject</font></a></font></b></td>
		</tr>
		<tr>
			<td align="left" bgcolor="#E2EAFE" height="24" width="20">&nbsp;</td>
			<td align="left" bgcolor="#E2EAFE" height="24" width="20">&nbsp;</td>
			<td align="left" bgcolor="#E2EAFE" height="24" width="140" valign="bottom"><b><font face="Arial" style="font-size: 9pt"><a href="http://www.FreedomsPhoenix.com/Radio-TV-Archives.htm?EdNo=220"><font color="#3234CD">Radio/TV Shows</font></a></font></b></td>
		</tr>
		<tr>
			<td align="left" bgcolor="#E2EAFE" height="24" width="20">&nbsp;</td>
			<td align="left" bgcolor="#E2EAFE" height="24" width="20">&nbsp;</td>
			<td align="left" bgcolor="#E2EAFE" height="24" width="140" valign="bottom"><b><font face="Arial" style="font-size: 9pt"><a href="http://www.FreedomsPhoenix.com/Articles-List.htm?EdNo=220"><font color="#3234CD">Feature Articles</font></a></font></b></td>
		</tr>
		<tr>
			<td align="left" bgcolor="#E2EAFE" height="24" width="20">&nbsp;</td>
			<td align="left" bgcolor="#E2EAFE" height="24" width="20">&nbsp;</td>
			<td align="left" bgcolor="#E2EAFE" height="24" width="140" valign="bottom"><b><font face="Arial" style="font-size: 9pt"><a href="http://www.FreedomsPhoenix.com/Editorials-List.htm?EdNo=220"><font color="#3234CD">Opinion Columns</font></a></font></b></td>
		</tr>
		<tr>
			<td align="left" bgcolor="#E2EAFE" height="24" width="20">&nbsp;</td>
			<td align="left" bgcolor="#E2EAFE" height="24" width="20">&nbsp;</td>
			<td align="left" bgcolor="#E2EAFE" height="24" width="140" valign="bottom"><b><font face="Arial" style="font-size: 9pt"><a href="http://www.FreedomsPhoenix.com/Current-News-List.htm?EdNo=220"><font color="#3234CD">News Stories</font></a></font></b></td>
		</tr>
		<tr>
			<td align="left" bgcolor="#E2EAFE" height="15" width="20">&nbsp;</td>
			<td align="left" bgcolor="#E2EAFE" height="24" width="20">&nbsp;</td>
			<td align="left" bgcolor="#E2EAFE" height="24" width="140" valign="bottom"><b><font face="Arial" style="font-size: 9pt"><a href="http://www.FreedomsPhoenix.com/Newsletters-List.htm?EdNo=220"><font color="#3234CD">Newsletters List</font></a></font></b></td>
		</tr>
		<tr>
			<td align="left" bgcolor="#E2EAFE" height="15" width="20">&nbsp;</td>
			<td align="left" bgcolor="#E2EAFE" height="24" width="20">&nbsp;</td>
			<td align="left" bgcolor="#E2EAFE" height="24" width="140" valign="bottom"><b><font face="Arial" style="font-size: 9pt"><a href="http://www.FreedomsPhoenix.com/Reference-List.htm?EdNo=220"><font color="#3234CD">Reference Links</font></a></font></b></td>
		</tr>
		<tr>
			<td align="center" bgcolor="#E2EAFE" width="180" colspan="3"><font size="1">&nbsp;</font></td>
		</tr>
		</table>
	</center>	<meta http-equiv="Content-Language" content="en-us">
	<center>
	<table border="0" cellpadding="0" cellspacing="0" style="border-collapse: collapse" bordercolor="#111111" width="180">
		<tr>
			<td align="center" bgcolor="#E2EAFE" width="180">
            &nbsp;<br><br>
			<font face="Arial" size="2" color="#3234CD">
			Thank you for reading 
			Freedom's Phoenix!</font>
            <br>&nbsp;<br>
			<font face="Arial" size="2" color="#3234CD">
			Thank you for reading 
			Freedom's Phoenix!</font>
            <br>&nbsp;<br>
			<font face="Arial" size="2" color="#3234CD">
			Thank you for reading 
			Freedom's Phoenix!</font>
            <br>&nbsp;<br>
			</td>
		</tr>
		</table>
	</center>			</td>
            <td width="14" bgcolor="#FFFFFF">
			<img border="0" src="http://www.FreedomsPhoenix.com/images/space.gif" width="14" height="10"></td>
            <td align="center" width="770" valign="top" bgcolor="#FFFFFF" height="90">
                <center>
                <table border="0" cellpadding="6" cellspacing="0" style="border-collapse: collapse" bordercolor="#111111" width="520">
                    <tr>
                        <td width="520" valign="top" bgcolor="#000000" colspan="7">
                        <p align="center"><b>
                        <font face="Arial" size="4" color="#0000FF">RADIO/TV SHOW ARCHIVES</font></b></td>
                    </tr>
                    <tr>
                    	<td bgcolor="#FFFF00" style="border-bottom-style: solid; border-bottom-width: 1" colspan="7">
                        <p align="center"><b><font face="Arial" size="2" color="#FF0000">
                        <a rel="nofollow" href="https://www.FreedomsPhoenix.com/Secure/Join-Us.htm?AddFrom=Yellow&EdNo=220">Sign up</a> </font>
                        <font face="Arial" size="2" color="#3234CD">to receive the Freedom's Phoenix Headlines by Email.</font></b></td>
                    </tr>
                    <tr>
                        <td valign="top" style="border-style:solid; border-width:1; " colspan="7">
                        <p align="center"><font face="Arial" size="3" color="#FF0000"><b>HELP FUND FREEDOM'S PHOENIX!</b></font><br>
                        <font face="Arial" size="2"><b><a rel="nofollow" href="https://www.FreedomsPhoenix.com/Secure/Contributions.htm">
						<font color="#3234CD">Make a one-time or periodic contribution.</font></a></b><br>Use your credit card or PayPal account.</font></td>
                    </tr>
                    <tr>
                        <td align="center" style="border-bottom-style: solid; border-bottom-width: 1" colspan="7">
                        <font face="Arial" size="2">&nbsp;<br>The most current Radio/TV Show Archives on <br><b>Freedom's Phoenix</b> in reverse chronological order:</font></td>
                    </tr>
                    <tr>
                        <td width="468" valign="top" align="center" style="border-bottom-style: solid; border-bottom-width: 1" colspan="7">
                    	<font color="#3234CD"><center><font face="Arial" size="2">Page 97 of 97<br><b><a href="Radio-TV-Archives.htm?PgNo=1"><font color="#3234CD">First</font></a>&nbsp; �&nbsp; <a href="Radio-TV-Archives.htm?PgNo=96"><font color="#3234CD">Back</font></a>&nbsp; �&nbsp; <a href="Radio-TV-Archives.htm?PgNo=94"><font color="#3234CD">94</font></a>&nbsp; �&nbsp; <a href="Radio-TV-Archives.htm?PgNo=95"><font color="#3234CD">95</font></a>&nbsp; �&nbsp; <a href="Radio-TV-Archives.htm?PgNo=96"><font color="#3234CD">96</font></a>&nbsp; �&nbsp; <span style="background-color: #FFFF00">&nbsp;<font color="#808080">97</font>&nbsp;</span>&nbsp; �&nbsp; <font color="#808080">Next</font>&nbsp; �&nbsp; <font color="#808080">Last</font></b></font></center></font>
                        </td>
                    </tr>
					<tr>
						<td bgcolor="#D7EBFF" style="border-bottom-style: solid; border-bottom-width: 1" colspan="7">
						<img border="0" src="http://www.FreedomsPhoenix.com/images/Media-Logos/Pix/Declare-Your-Independence-with-Ernest-Hancock---Radio-Show-Pix.jpg" hspace="10" width="139" height="100" align="left">
						<font face="Arial" size="1">Radio/TV Show&nbsp; �&nbsp; 
						<b><a target="_blank" href="http://www.FreedomsPhoenix.com/Subjects/00189-LAST-declare-your-independence-with-ernest-hancock.htm">
						<font color="#3234CD">Declare Your Independence with Ernest Hancock</font></a></b></font><br>
						<b>
						<a target="_blank" href="http://www.freedomsphoenix.com/Program-Page.htm?No=0001">
						<font face="Arial" color="#3234CD">Declare Your Independence with Ernest Hancock - Radio</font></a></b><br>
						
						<font face="Arial" size="2">Host: <b><a target="_blank" href="Writer-Bio-Page.htm?EditNo=001">
						<font color="#3234CD" face="Arial" size="2">Ernest Hancock</font></a></b></font><br>
						<a href="http://www.FreedomsPhoenix.com/Media/160010-2014-07-22-07-25-14-daniel-larimer-cody-wilson-listen-live-on.htm">
						<b><font face="Arial" size="4" color="#3234CD">07-25-14-- Daniel Larimer - Cody Wilson - LISTEN LIVE on LRN.FM, M-F, 9-Noon (EDT)</font></b></a><br>
						<font face="Arial" size="2">Program Date:&nbsp; <b>2014-07-25</b></font><br>
						<font face="Arial" size="2">&nbsp;&nbsp; Daniel Larimer (Founder of BitShares) comes on the show to discuss the attempt by New York to regulate Bitcoin by instituting a Bitcoin License - Cody Wilson (Defense Distributed, Dark Wallet) on Bitcoin/Cryptocurrency anonymity, bitcoin regulation a</font></td>
					</tr>
					<tr>
						<td width="456" colspan="7" bgcolor="#D7EBFF" style="border-top-style: none; border-top-width: medium; border-bottom-style: solid; border-bottom-width: 1" align="center">
						<a target="_blank" href="Add-Comment.htm?EdNo=001&Type=Media&Info=160010">
						<img border="0" src="../images/Buttons/Make-a-Comment.gif" width="81" height="11"></a>
						<font face="Arial" size="2" color="#3234CD">�</font>
						<a href="/Email-Story.htm?EdNo=001&Info=0284643">
						<img border="0" src="../images/Buttons/Email-Link.gif" width="57" height="11"></a>
						<font face="Arial" size="2" color="#3234CD">�</font>
						<a target="_blank" href="Add-Letter.htm?EdNo=001&Info=0284643">
						<img border="0" src="../images/Buttons/Send-Letter-to-Editor.gif" width="92" height="11"></a>
						<font face="Arial" size="2" color="#3234CD">�</font>
						<a target="_blank" href="Save-Link.htm?EdNo=001&Info=0284643">
						<img border="0" src="../images/Buttons/Save-Link.gif" width="53" height="11"></a><br>
						</td>
					</tr>
					<tr>
						<td bgcolor="#D7EBFF" style="border-bottom-style: solid; border-bottom-width: 1" colspan="7">
						<img border="0" src="http://www.FreedomsPhoenix.com/images/Media-Logos/Pix/Declare-Your-Independence-with-Ernest-Hancock---Radio-Show-Pix.jpg" hspace="10" width="139" height="100" align="left">
						<font face="Arial" size="1">Radio/TV Show&nbsp; �&nbsp; 
						<b><a target="_blank" href="http://www.FreedomsPhoenix.com/Subjects/00189-LAST-declare-your-independence-with-ernest-hancock.htm">
						<font color="#3234CD">Declare Your Independence with Ernest Hancock</font></a></b></font><br>
						<b>
						<a target="_blank" href="http://www.freedomsphoenix.com/Program-Page.htm?No=0001">
						<font face="Arial" color="#3234CD">Declare Your Independence with Ernest Hancock - Radio</font></a></b><br>
						
						<font face="Arial" size="2">Host: <b><a target="_blank" href="Writer-Bio-Page.htm?EditNo=001">
						<font color="#3234CD" face="Arial" size="2">Ernest Hancock</font></a></b></font><br>
						<a href="http://www.FreedomsPhoenix.com/Media/160009-2014-07-22-07-24-14-tone-vays-j-neil-schulman-janelle-wood.htm">
						<b><font face="Arial" size="4" color="#3234CD">07-24-14 -- Tone Vays - J Neil Schulman - Janelle Wood -- LISTEN LIVE on LRN.FM, M-F, 9-Noon EDT</font></b></a><br>
						<font face="Arial" size="2">Program Date:&nbsp; <b>2014-07-24</b></font><br>
						<font face="Arial" size="2">&nbsp;&nbsp; Tone Vays (LibertyLifeTrail.Com) on the attempt by New York to regulate Bitcoin by instituting a Bitcoin License - J Neil Schulman (writer and filmmaker) on his film Alongside Night, showing tonight Scottsdale Studio Movie Grill 7:30 pm - Janelle Woo</font></td>
					</tr>
					<tr>
						<td width="456" colspan="7" bgcolor="#D7EBFF" style="border-top-style: none; border-top-width: medium; border-bottom-style: solid; border-bottom-width: 1" align="center">
						<a target="_blank" href="Add-Comment.htm?EdNo=001&Type=Media&Info=160009">
						<img border="0" src="../images/Buttons/Make-a-Comment.gif" width="81" height="11"></a>
						<font face="Arial" size="2" color="#3234CD">�</font>
						<a href="/Email-Story.htm?EdNo=001&Info=0284640">
						<img border="0" src="../images/Buttons/Email-Link.gif" width="57" height="11"></a>
						<font face="Arial" size="2" color="#3234CD">�</font>
						<a target="_blank" href="Add-Letter.htm?EdNo=001&Info=0284640">
						<img border="0" src="../images/Buttons/Send-Letter-to-Editor.gif" width="92" height="11"></a>
						<font face="Arial" size="2" color="#3234CD">�</font>
						<a target="_blank" href="Save-Link.htm?EdNo=001&Info=0284640">
						<img border="0" src="../images/Buttons/Save-Link.gif" width="53" height="11"></a><br>
						</td>
					</tr>
					<tr>
						<td bgcolor="#D7EBFF" style="border-bottom-style: solid; border-bottom-width: 1" colspan="7">
						<img border="0" src="http://www.FreedomsPhoenix.com/images/Media-Logos/Pix/Declare-Your-Independence-with-Ernest-Hancock---Radio-Show-Pix.jpg" hspace="10" width="139" height="100" align="left">
						<font face="Arial" size="1">Radio/TV Show&nbsp; �&nbsp; 
						<b><a target="_blank" href="http://www.FreedomsPhoenix.com/Subjects/00189-LAST-declare-your-independence-with-ernest-hancock.htm">
						<font color="#3234CD">Declare Your Independence with Ernest Hancock</font></a></b></font><br>
						<b>
						<a target="_blank" href="http://www.freedomsphoenix.com/Program-Page.htm?No=0001">
						<font face="Arial" color="#3234CD">Declare Your Independence with Ernest Hancock - Radio</font></a></b><br>
						
						<font face="Arial" size="2">Host: <b><a target="_blank" href="Writer-Bio-Page.htm?EditNo=001">
						<font color="#3234CD" face="Arial" size="2">Ernest Hancock</font></a></b></font><br>
						<a href="http://www.FreedomsPhoenix.com/Media/160003-2014-07-22-07-23-14-paul-snow-jeffrey-tucker-matt-papke-video.htm">
						<b><font face="Arial" size="4" color="#3234CD">07-23-14 -- Paul Snow - Jeffrey Tucker - Matt Papke -- (VIDEO & MP3 LOADED)</font></b></a><br>
						<font face="Arial" size="2">Program Date:&nbsp; <b>2014-07-23</b></font><br>
						<font face="Arial" size="2">&nbsp;&nbsp; Paul Snow (President Texas Bitcoin Assoc and Founder, Passing Bitcoin Around the World) on NY's attempt to regulate Bitcoin - Jeffrey Tucker (Liberty.Me) on NY's plan for a Bitcoin License - Matt Papke (FreeTempe.Com) Fundraiser Friday July 25th, 201</font></td>
					</tr>
					<tr>
						<td width="456" colspan="7" bgcolor="#D7EBFF" style="border-top-style: none; border-top-width: medium; border-bottom-style: solid; border-bottom-width: 1" align="center">
						<a target="_blank" href="Add-Comment.htm?EdNo=001&Type=Media&Info=160003">
						<img border="0" src="../images/Buttons/Make-a-Comment.gif" width="81" height="11"></a>
						<font face="Arial" size="2" color="#3234CD">�</font>
						<a href="/Email-Story.htm?EdNo=001&Info=0284629">
						<img border="0" src="../images/Buttons/Email-Link.gif" width="57" height="11"></a>
						<font face="Arial" size="2" color="#3234CD">�</font>
						<a target="_blank" href="Add-Letter.htm?EdNo=001&Info=0284629">
						<img border="0" src="../images/Buttons/Send-Letter-to-Editor.gif" width="92" height="11"></a>
						<font face="Arial" size="2" color="#3234CD">�</font>
						<a target="_blank" href="Save-Link.htm?EdNo=001&Info=0284629">
						<img border="0" src="../images/Buttons/Save-Link.gif" width="53" height="11"></a><br>
						</td>
					</tr>
					<tr>
						<td style="border-bottom-style: solid; border-bottom-width: 1" bgcolor="#FFFFFF" align="center" height="80" colspan="7">
<a href="http://www.FreedomsPhoenix.com/SendTo.htm?AdNo=0871&EdNo=220" target="_blank"><img src="_Ads/Graphics/Ernest-Hancock-039.jpg" width="120" height="600" border="0" alt=""></a>						</td>
					</tr>
					<tr>
						<td bgcolor="#D7EBFF" style="border-bottom-style: solid; border-bottom-width: 1" colspan="7">
						<img border="0" src="http://www.FreedomsPhoenix.com/images/Media-Logos/Pix/Declare-Your-Independence-with-Ernest-Hancock---Radio-Show-Pix.jpg" hspace="10" width="139" height="100" align="left">
						<font face="Arial" size="1">Radio/TV Show&nbsp; �&nbsp; 
						<b><a target="_blank" href="http://www.FreedomsPhoenix.com/Subjects/00189-LAST-declare-your-independence-with-ernest-hancock.htm">
						<font color="#3234CD">Declare Your Independence with Ernest Hancock</font></a></b></font><br>
						<b>
						<a target="_blank" href="http://www.freedomsphoenix.com/Program-Page.htm?No=0001">
						<font face="Arial" color="#3234CD">Declare Your Independence with Ernest Hancock - Radio</font></a></b><br>
						
						<font face="Arial" size="2">Host: <b><a target="_blank" href="Writer-Bio-Page.htm?EditNo=001">
						<font color="#3234CD" face="Arial" size="2">Ernest Hancock</font></a></b></font><br>
						<a href="http://www.FreedomsPhoenix.com/Media/159913-2014-07-22-07-22-14-alma-sommer-leo-magpoc-video-mp3-loaded.htm">
						<b><font face="Arial" size="4" color="#3234CD">07-22-14 -- Alma Sommer - Leo Magpoc - (VIDEO & MP3 LOADED)</font></b></a><br>
						<font face="Arial" size="2">Program Date:&nbsp; <b>2014-07-22</b></font><br>
						<font face="Arial" size="2">&nbsp;&nbsp; Alma Sommer (Agorist Marketplace and Jackalope Freedom Festival) and Leo Magpoc (local activist) come in studio to talk about the Jackalope Freedom Festival coming up in Northern Arizona August 1-3, 2014, Baca Meadows near Forest Lakes, AZ</font></td>
					</tr>
					<tr>
						<td width="456" colspan="7" bgcolor="#D7EBFF" style="border-top-style: none; border-top-width: medium; border-bottom-style: solid; border-bottom-width: 1" align="center">
						<a target="_blank" href="Add-Comment.htm?EdNo=001&Type=Media&Info=159913">
						<img border="0" src="../images/Buttons/Make-a-Comment.gif" width="81" height="11"></a>
						<font face="Arial" size="2" color="#3234CD">�</font>
						<a href="/Email-Story.htm?EdNo=001&Info=0284466">
						<img border="0" src="../images/Buttons/Email-Link.gif" width="57" height="11"></a>
						<font face="Arial" size="2" color="#3234CD">�</font>
						<a target="_blank" href="Add-Letter.htm?EdNo=001&Info=0284466">
						<img border="0" src="../images/Buttons/Send-Letter-to-Editor.gif" width="92" height="11"></a>
						<font face="Arial" size="2" color="#3234CD">�</font>
						<a target="_blank" href="Save-Link.htm?EdNo=001&Info=0284466">
						<img border="0" src="../images/Buttons/Save-Link.gif" width="53" height="11"></a><br>
						</td>
					</tr>
					<tr>
						<td bgcolor="#D7EBFF" style="border-bottom-style: solid; border-bottom-width: 1" colspan="7">
						<img border="0" src="http://www.FreedomsPhoenix.com/images/Media-Logos/Pix/Declare-Your-Independence-with-Ernest-Hancock---Radio-Show-Pix.jpg" hspace="10" width="139" height="100" align="left">
						<font face="Arial" size="1">Radio/TV Show&nbsp; �&nbsp; 
						<b><a target="_blank" href="http://www.FreedomsPhoenix.com/Subjects/00189-LAST-declare-your-independence-with-ernest-hancock.htm">
						<font color="#3234CD">Declare Your Independence with Ernest Hancock</font></a></b></font><br>
						<b>
						<a target="_blank" href="http://www.freedomsphoenix.com/Program-Page.htm?No=0001">
						<font face="Arial" color="#3234CD">Declare Your Independence with Ernest Hancock - Radio</font></a></b><br>
						
						<font face="Arial" size="2">Host: <b><a target="_blank" href="Writer-Bio-Page.htm?EditNo=001">
						<font color="#3234CD" face="Arial" size="2">Ernest Hancock</font></a></b></font><br>
						<a href="http://www.FreedomsPhoenix.com/Media/159693-2014-07-18-07-18-14-ruben-salinas-video-bonus-mp3-loaded.htm">
						<b><font face="Arial" size="4" color="#3234CD">07-18-14 -- Ruben Salinas - (VIDEO + BONUS & MP3 LOADED)</font></b></a><br>
						<font face="Arial" size="2">Program Date:&nbsp; <b>2014-07-18</b></font><br>
						<font face="Arial" size="2">&nbsp;&nbsp; Ruben Salinas comes on the show to talk about his experience with Neurofeedback and Alpha training as it relates to Achieving Mastery, and more specifically to Self-Mastery. Ruben authored The Mastery Code to share these find</font></td>
					</tr>
					<tr>
						<td width="456" colspan="7" bgcolor="#D7EBFF" style="border-top-style: none; border-top-width: medium; border-bottom-style: solid; border-bottom-width: 1" align="center">
						<a target="_blank" href="Add-Comment.htm?EdNo=001&Type=Media&Info=159693">
						<img border="0" src="../images/Buttons/Make-a-Comment.gif" width="81" height="11"></a>
						<font face="Arial" size="2" color="#3234CD">�</font>
						<a href="/Email-Story.htm?EdNo=001&Info=0284071">
						<img border="0" src="../images/Buttons/Email-Link.gif" width="57" height="11"></a>
						<font face="Arial" size="2" color="#3234CD">�</font>
						<a target="_blank" href="Add-Letter.htm?EdNo=001&Info=0284071">
						<img border="0" src="../images/Buttons/Send-Letter-to-Editor.gif" width="92" height="11"></a>
						<font face="Arial" size="2" color="#3234CD">�</font>
						<a target="_blank" href="Save-Link.htm?EdNo=001&Info=0284071">
						<img border="0" src="../images/Buttons/Save-Link.gif" width="53" height="11"></a><br>
						</td>
					</tr>
					<tr>
						<td bgcolor="#D7EBFF" style="border-bottom-style: solid; border-bottom-width: 1" colspan="7">
						<img border="0" src="http://www.FreedomsPhoenix.com/images/Media-Logos/Pix/Declare-Your-Independence-with-Ernest-Hancock---Radio-Show-Pix.jpg" hspace="10" width="139" height="100" align="left">
						<font face="Arial" size="1">Radio/TV Show&nbsp; �&nbsp; 
						<b><a target="_blank" href="http://www.FreedomsPhoenix.com/Subjects/00189-LAST-declare-your-independence-with-ernest-hancock.htm">
						<font color="#3234CD">Declare Your Independence with Ernest Hancock</font></a></b></font><br>
						<b>
						<a target="_blank" href="http://www.freedomsphoenix.com/Program-Page.htm?No=0001">
						<font face="Arial" color="#3234CD">Declare Your Independence with Ernest Hancock - Radio</font></a></b><br>
						
						<font face="Arial" size="2">Host: <b><a target="_blank" href="Writer-Bio-Page.htm?EditNo=001">
						<font color="#3234CD" face="Arial" size="2">Ernest Hancock</font></a></b></font><br>
						<a href="http://www.FreedomsPhoenix.com/Media/159633-2014-07-17-07-17-14-keith-cyrnek-dr-phranq-tamburri-sarara-corva.htm">
						<b><font face="Arial" size="4" color="#3234CD">07-17-14 -- Keith Cyrnek - Dr. Phranq Tamburri - Sarara Corva (Video & MP3 LOADED+BONUS)</font></b></a><br>
						<font face="Arial" size="2">Program Date:&nbsp; <b>2014-07-17</b></font><br>
						<font face="Arial" size="2">&nbsp;&nbsp; Keith Cyrnek (local activist) on border patrol checkpoints - Dr. Phranq Tamburri (Longevity Medical Center) updates us on healthcare and medical marijuana - Sarara Corva (Medical Marijuana Education Expert) on medicinal uses of Cannabis</font></td>
					</tr>
					<tr>
						<td width="456" colspan="7" bgcolor="#D7EBFF" style="border-top-style: none; border-top-width: medium; border-bottom-style: solid; border-bottom-width: 1" align="center">
						<a target="_blank" href="Add-Comment.htm?EdNo=001&Type=Media&Info=159633">
						<img border="0" src="../images/Buttons/Make-a-Comment.gif" width="81" height="11"></a>
						<font face="Arial" size="2" color="#3234CD">�</font>
						<a href="/Email-Story.htm?EdNo=001&Info=0283974">
						<img border="0" src="../images/Buttons/Email-Link.gif" width="57" height="11"></a>
						<font face="Arial" size="2" color="#3234CD">�</font>
						<a target="_blank" href="Add-Letter.htm?EdNo=001&Info=0283974">
						<img border="0" src="../images/Buttons/Send-Letter-to-Editor.gif" width="92" height="11"></a>
						<font face="Arial" size="2" color="#3234CD">�</font>
						<a target="_blank" href="Save-Link.htm?EdNo=001&Info=0283974">
						<img border="0" src="../images/Buttons/Save-Link.gif" width="53" height="11"></a><br>
						</td>
					</tr>
					<tr>
						<td bgcolor="#D7EBFF" style="border-bottom-style: solid; border-bottom-width: 1" colspan="7">
						<img border="0" src="http://www.FreedomsPhoenix.com/images/Media-Logos/Pix/Declare-Your-Independence-with-Ernest-Hancock---Radio-Show-Pix.jpg" hspace="10" width="139" height="100" align="left">
						<font face="Arial" size="1">Radio/TV Show&nbsp; �&nbsp; 
						<b><a target="_blank" href="http://www.FreedomsPhoenix.com/Subjects/00189-LAST-declare-your-independence-with-ernest-hancock.htm">
						<font color="#3234CD">Declare Your Independence with Ernest Hancock</font></a></b></font><br>
						<b>
						<a target="_blank" href="http://www.freedomsphoenix.com/Program-Page.htm?No=0001">
						<font face="Arial" color="#3234CD">Declare Your Independence with Ernest Hancock - Radio</font></a></b><br>
						
						<font face="Arial" size="2">Host: <b><a target="_blank" href="Writer-Bio-Page.htm?EditNo=001">
						<font color="#3234CD" face="Arial" size="2">Ernest Hancock</font></a></b></font><br>
						<a href="http://www.FreedomsPhoenix.com/Media/159512-2014-07-15-07-16-14-robert-mathias-john-whitehead-mp3-video-loaded.htm">
						<b><font face="Arial" size="4" color="#3234CD">07-16-14 -- Robert Mathias - John Whitehead (MP3 & VIDEO LOADED)</font></b></a><br>
						<font face="Arial" size="2">Program Date:&nbsp; <b>2014-07-16</b></font><br>
						<font face="Arial" size="2">&nbsp;&nbsp; Robert Mathias (RebelLOV3show.com) shares his brand of activism, spreading the love of a liberated world - John Whitehead (Rutherford Institute) comes on the show to talk about his recent article 'What I Don�t Like About Life in the American Police S</font></td>
					</tr>
					<tr>
						<td width="456" colspan="7" bgcolor="#D7EBFF" style="border-top-style: none; border-top-width: medium; border-bottom-style: solid; border-bottom-width: 1" align="center">
						<a target="_blank" href="Add-Comment.htm?EdNo=001&Type=Media&Info=159512">
						<img border="0" src="../images/Buttons/Make-a-Comment.gif" width="81" height="11"></a>
						<font face="Arial" size="2" color="#3234CD">�</font>
						<a href="/Email-Story.htm?EdNo=001&Info=0283775">
						<img border="0" src="../images/Buttons/Email-Link.gif" width="57" height="11"></a>
						<font face="Arial" size="2" color="#3234CD">�</font>
						<a target="_blank" href="Add-Letter.htm?EdNo=001&Info=0283775">
						<img border="0" src="../images/Buttons/Send-Letter-to-Editor.gif" width="92" height="11"></a>
						<font face="Arial" size="2" color="#3234CD">�</font>
						<a target="_blank" href="Save-Link.htm?EdNo=001&Info=0283775">
						<img border="0" src="../images/Buttons/Save-Link.gif" width="53" height="11"></a><br>
						</td>
					</tr>
					<tr>
						<td style="border-bottom-style: solid; border-bottom-width: 1" bgcolor="#FFFFFF" align="center" height="80" colspan="7">
<a href="http://www.FreedomsPhoenix.com/SendTo.htm?AdNo=1245&EdNo=220" target="_blank"><img src="_Ads/Graphics/Agorist-Alma-003.jpg" width="728" height="90" border="0" alt="Agorist Marketplace"></a>						</td>
					</tr>
					<tr>
						<td bgcolor="#D7EBFF" style="border-bottom-style: solid; border-bottom-width: 1" colspan="7">
						<img border="0" src="http://www.FreedomsPhoenix.com/images/Media-Logos/Pix/Declare-Your-Independence-with-Ernest-Hancock---Radio-Show-Pix.jpg" hspace="10" width="139" height="100" align="left">
						<font face="Arial" size="1">Radio/TV Show&nbsp; �&nbsp; 
						<b><a target="_blank" href="http://www.FreedomsPhoenix.com/Subjects/00189-LAST-declare-your-independence-with-ernest-hancock.htm">
						<font color="#3234CD">Declare Your Independence with Ernest Hancock</font></a></b></font><br>
						<b>
						<a target="_blank" href="http://www.freedomsphoenix.com/Program-Page.htm?No=0001">
						<font face="Arial" color="#3234CD">Declare Your Independence with Ernest Hancock - Radio</font></a></b><br>
						
						<font face="Arial" size="2">Host: <b><a target="_blank" href="Writer-Bio-Page.htm?EditNo=001">
						<font color="#3234CD" face="Arial" size="2">Ernest Hancock</font></a></b></font><br>
						<a href="http://www.FreedomsPhoenix.com/Media/159485-2014-07-15-07-15-14-david-johnston-howard-wooldridge-barry-hess-mp3.htm">
						<b><font face="Arial" size="4" color="#3234CD">07-15-14 -- David Johnston - Howard Wooldridge - Barry Hess (MP3 & VIDEO + BONUS LOADED)</font></b></a><br>
						<font face="Arial" size="2">Program Date:&nbsp; <b>2014-07-15</b></font><br>
						<font face="Arial" size="2">&nbsp;&nbsp; David Johnston (BitAngels) provides an update on Bitcion - Howard Wooldridge (CitizensOpposingProhibition.org) on the children/drug war refugees on the southern border - Barry Hess (Libertarian for AZ Governor) comes in studio to give an update on h</font></td>
					</tr>
					<tr>
						<td width="456" colspan="7" bgcolor="#D7EBFF" style="border-top-style: none; border-top-width: medium; border-bottom-style: solid; border-bottom-width: 1" align="center">
						<a target="_blank" href="Add-Comment.htm?EdNo=001&Type=Media&Info=159485">
						<img border="0" src="../images/Buttons/Make-a-Comment.gif" width="81" height="11"></a>
						<font face="Arial" size="2" color="#3234CD">�</font>
						<a href="/Email-Story.htm?EdNo=001&Info=0283707">
						<img border="0" src="../images/Buttons/Email-Link.gif" width="57" height="11"></a>
						<font face="Arial" size="2" color="#3234CD">�</font>
						<a target="_blank" href="Add-Letter.htm?EdNo=001&Info=0283707">
						<img border="0" src="../images/Buttons/Send-Letter-to-Editor.gif" width="92" height="11"></a>
						<font face="Arial" size="2" color="#3234CD">�</font>
						<a target="_blank" href="Save-Link.htm?EdNo=001&Info=0283707">
						<img border="0" src="../images/Buttons/Save-Link.gif" width="53" height="11"></a><br>
						</td>
					</tr>
					<tr>
						<td bgcolor="#D7EBFF" style="border-bottom-style: solid; border-bottom-width: 1" colspan="7">
						<img border="0" src="http://www.FreedomsPhoenix.com/images/Media-Logos/Pix/Declare-Your-Independence-with-Ernest-Hancock---Radio-Show-Pix.jpg" hspace="10" width="139" height="100" align="left">
						<font face="Arial" size="1">Radio/TV Show&nbsp; �&nbsp; 
						<b><a target="_blank" href="http://www.FreedomsPhoenix.com/Subjects/00189-LAST-declare-your-independence-with-ernest-hancock.htm">
						<font color="#3234CD">Declare Your Independence with Ernest Hancock</font></a></b></font><br>
						<b>
						<a target="_blank" href="http://www.freedomsphoenix.com/Program-Page.htm?No=0001">
						<font face="Arial" color="#3234CD">Declare Your Independence with Ernest Hancock - Radio</font></a></b><br>
						
						<font face="Arial" size="2">Host: <b><a target="_blank" href="Writer-Bio-Page.htm?EditNo=001">
						<font color="#3234CD" face="Arial" size="2">Ernest Hancock</font></a></b></font><br>
						<a href="http://www.FreedomsPhoenix.com/Media/159255-2014-07-10-07-11-14-tone-vays-peter-mathews-sheldon-richman-mp3.htm">
						<b><font face="Arial" size="4" color="#3234CD">07-11-14 -- Tone Vays - Peter Mathews - Sheldon Richman (MP3 & VIDEO LOADED)</font></b></a><br>
						<font face="Arial" size="2">Program Date:&nbsp; <b>2014-07-11</b></font><br>
						<font face="Arial" size="2">&nbsp;&nbsp; Tone Vays (LibertyLifeTrail.Com) on the Hong Kong Bitcoin Conference; also comments on the recent Bitcoin thefts - Peter Mathews (Professor) on his new book Dollar Democracy: with Liberty and Justice for Some - Sheldon Richman (VP of www.FFF.org</font></td>
					</tr>
					<tr>
						<td width="456" colspan="7" bgcolor="#D7EBFF" style="border-top-style: none; border-top-width: medium; border-bottom-style: solid; border-bottom-width: 1" align="center">
						<a target="_blank" href="Add-Comment.htm?EdNo=001&Type=Media&Info=159255">
						<img border="0" src="../images/Buttons/Make-a-Comment.gif" width="81" height="11"></a>
						<font face="Arial" size="2" color="#3234CD">�</font>
						<a href="/Email-Story.htm?EdNo=001&Info=0283284">
						<img border="0" src="../images/Buttons/Email-Link.gif" width="57" height="11"></a>
						<font face="Arial" size="2" color="#3234CD">�</font>
						<a target="_blank" href="Add-Letter.htm?EdNo=001&Info=0283284">
						<img border="0" src="../images/Buttons/Send-Letter-to-Editor.gif" width="92" height="11"></a>
						<font face="Arial" size="2" color="#3234CD">�</font>
						<a target="_blank" href="Save-Link.htm?EdNo=001&Info=0283284">
						<img border="0" src="../images/Buttons/Save-Link.gif" width="53" height="11"></a><br>
						</td>
					</tr>
					<tr>
						<td bgcolor="#D7EBFF" style="border-bottom-style: solid; border-bottom-width: 1" colspan="7">
						<img border="0" src="http://www.FreedomsPhoenix.com/images/Media-Logos/Pix/Declare-Your-Independence-with-Ernest-Hancock---Radio-Show-Pix.jpg" hspace="10" width="139" height="100" align="left">
						<font face="Arial" size="1">Radio/TV Show&nbsp; �&nbsp; 
						<b><a target="_blank" href="http://www.FreedomsPhoenix.com/Subjects/00189-LAST-declare-your-independence-with-ernest-hancock.htm">
						<font color="#3234CD">Declare Your Independence with Ernest Hancock</font></a></b></font><br>
						<b>
						<a target="_blank" href="http://www.freedomsphoenix.com/Program-Page.htm?No=0001">
						<font face="Arial" color="#3234CD">Declare Your Independence with Ernest Hancock - Radio</font></a></b><br>
						
						<font face="Arial" size="2">Host: <b><a target="_blank" href="Writer-Bio-Page.htm?EditNo=001">
						<font color="#3234CD" face="Arial" size="2">Ernest Hancock</font></a></b></font><br>
						<a href="http://www.FreedomsPhoenix.com/Media/159183-2014-07-09-07-10-14-davi-barker-kristov-atlas-video-mp3-loaded.htm">
						<b><font face="Arial" size="4" color="#3234CD">07-10-14 -- Davi Barker - Kristov Atlas - (VIDEO & MP3 LOADED) - BONUS INTERVIEW @ END OF SHOW</font></b></a><br>
						<font face="Arial" size="2">Program Date:&nbsp; <b>2014-07-10</b></font><br>
						<font face="Arial" size="2">&nbsp;&nbsp; Davi Barker (BitcoinNotBombs.Com) on Bitcoin Thefts - Kristov Atlas (computer security consultant) on his book, Anonymous Bitcoin. Kristov comments on the recent Bitcoin thefts</font></td>
					</tr>
					<tr>
						<td width="456" colspan="7" bgcolor="#D7EBFF" style="border-top-style: none; border-top-width: medium; border-bottom-style: solid; border-bottom-width: 1" align="center">
						<a target="_blank" href="Add-Comment.htm?EdNo=001&Type=Media&Info=159183">
						<img border="0" src="../images/Buttons/Make-a-Comment.gif" width="81" height="11"></a>
						<font face="Arial" size="2" color="#3234CD">�</font>
						<a href="/Email-Story.htm?EdNo=001&Info=0283171">
						<img border="0" src="../images/Buttons/Email-Link.gif" width="57" height="11"></a>
						<font face="Arial" size="2" color="#3234CD">�</font>
						<a target="_blank" href="Add-Letter.htm?EdNo=001&Info=0283171">
						<img border="0" src="../images/Buttons/Send-Letter-to-Editor.gif" width="92" height="11"></a>
						<font face="Arial" size="2" color="#3234CD">�</font>
						<a target="_blank" href="Save-Link.htm?EdNo=001&Info=0283171">
						<img border="0" src="../images/Buttons/Save-Link.gif" width="53" height="11"></a><br>
						</td>
					</tr>
					<tr>
						<td bgcolor="#D7EBFF" style="border-bottom-style: solid; border-bottom-width: 1" colspan="7">
						<img border="0" src="http://www.FreedomsPhoenix.com/images/Media-Logos/Pix/Declare-Your-Independence-with-Ernest-Hancock---Radio-Show-Pix.jpg" hspace="10" width="139" height="100" align="left">
						<font face="Arial" size="1">Radio/TV Show&nbsp; �&nbsp; 
						<b><a target="_blank" href="http://www.FreedomsPhoenix.com/Subjects/00189-LAST-declare-your-independence-with-ernest-hancock.htm">
						<font color="#3234CD">Declare Your Independence with Ernest Hancock</font></a></b></font><br>
						<b>
						<a target="_blank" href="http://www.freedomsphoenix.com/Program-Page.htm?No=0001">
						<font face="Arial" color="#3234CD">Declare Your Independence with Ernest Hancock - Radio</font></a></b><br>
						
						<font face="Arial" size="2">Host: <b><a target="_blank" href="Writer-Bio-Page.htm?EditNo=001">
						<font color="#3234CD" face="Arial" size="2">Ernest Hancock</font></a></b></font><br>
						<a href="http://www.FreedomsPhoenix.com/Media/159153-2014-07-09-07-09-14-stephan-kinsella-reed-jessen-video-mp3-loaded.htm">
						<b><font face="Arial" size="4" color="#3234CD">07-09-14 -- Stephan Kinsella - Reed Jessen - (VIDEO & MP3 LOADED)</font></b></a><br>
						<font face="Arial" size="2">Program Date:&nbsp; <b>2014-07-09</b></font><br>
						<font face="Arial" size="2">&nbsp;&nbsp; Stephan Kinsella (Intellectual Property/Patent Attorney) on the constitutionality of Intellectual Property; Cryptocurrency/Bitcoin - Reed Jessen (Founder of The Cryptocurrency Defense Foundation) on defending the cryptocurrency economy. </font></td>
					</tr>
					<tr>
						<td width="456" colspan="7" bgcolor="#D7EBFF" style="border-top-style: none; border-top-width: medium; border-bottom-style: solid; border-bottom-width: 1" align="center">
						<img border="0" src="../images/Comments.gif" width="54" height="11">
						<font face="Arial" size="1" color="#3234CD"> 1</font>
						<font face="Arial" size="2" color="#3234CD">�</font>
						<a target="_blank" href="Add-Comment.htm?EdNo=001&Type=Media&Info=159153">
						<img border="0" src="../images/Buttons/Make-a-Comment.gif" width="81" height="11"></a>
						<font face="Arial" size="2" color="#3234CD">�</font>
						<a href="/Email-Story.htm?EdNo=001&Info=0283129">
						<img border="0" src="../images/Buttons/Email-Link.gif" width="57" height="11"></a>
						<font face="Arial" size="2" color="#3234CD">�</font>
						<a target="_blank" href="Add-Letter.htm?EdNo=001&Info=0283129">
						<img border="0" src="../images/Buttons/Send-Letter-to-Editor.gif" width="92" height="11"></a>
						<font face="Arial" size="2" color="#3234CD">�</font>
						<a target="_blank" href="Save-Link.htm?EdNo=001&Info=0283129">
						<img border="0" src="../images/Buttons/Save-Link.gif" width="53" height="11"></a><br>
						</td>
					</tr>
					<tr>
						<td bgcolor="#D7EBFF" style="border-bottom-style: solid; border-bottom-width: 1" colspan="7">
						<img border="0" src="http://www.FreedomsPhoenix.com/images/Media-Logos/Pix/Declare-Your-Independence-with-Ernest-Hancock---Radio-Show-Pix.jpg" hspace="10" width="139" height="100" align="left">
						<font face="Arial" size="1">Radio/TV Show&nbsp; �&nbsp; 
						<b><a target="_blank" href="http://www.FreedomsPhoenix.com/Subjects/00189-LAST-declare-your-independence-with-ernest-hancock.htm">
						<font color="#3234CD">Declare Your Independence with Ernest Hancock</font></a></b></font><br>
						<b>
						<a target="_blank" href="http://www.freedomsphoenix.com/Program-Page.htm?No=0001">
						<font face="Arial" color="#3234CD">Declare Your Independence with Ernest Hancock - Radio</font></a></b><br>
						
						<font face="Arial" size="2">Host: <b><a target="_blank" href="Writer-Bio-Page.htm?EditNo=001">
						<font color="#3234CD" face="Arial" size="2">Ernest Hancock</font></a></b></font><br>
						<a href="http://www.FreedomsPhoenix.com/Media/159090-2014-07-08-07-08-14-were-back-live-in-studio-this-morning.htm">
						<b><font face="Arial" size="4" color="#3234CD">07-08-14 -- We're back live in studio this morning! - (MP3 & VIDEO LOADED)</font></b></a><br>
						<font face="Arial" size="2">Program Date:&nbsp; <b>2014-07-08</b></font><br>
						<font face="Arial" size="2">&nbsp;&nbsp; After attending Porcfest and taking a short vacation to visit with friends, Ernest is back live in studio this morning and will re-cap his trip, and discuss future projects. Donna Hancock joins the conversation in the 3rd hour...</font></td>
					</tr>
					<tr>
						<td width="456" colspan="7" bgcolor="#D7EBFF" style="border-top-style: none; border-top-width: medium; border-bottom-style: solid; border-bottom-width: 1" align="center">
						<a target="_blank" href="Add-Comment.htm?EdNo=001&Type=Media&Info=159090">
						<img border="0" src="../images/Buttons/Make-a-Comment.gif" width="81" height="11"></a>
						<font face="Arial" size="2" color="#3234CD">�</font>
						<a href="/Email-Story.htm?EdNo=001&Info=0282991">
						<img border="0" src="../images/Buttons/Email-Link.gif" width="57" height="11"></a>
						<font face="Arial" size="2" color="#3234CD">�</font>
						<a target="_blank" href="Add-Letter.htm?EdNo=001&Info=0282991">
						<img border="0" src="../images/Buttons/Send-Letter-to-Editor.gif" width="92" height="11"></a>
						<font face="Arial" size="2" color="#3234CD">�</font>
						<a target="_blank" href="Save-Link.htm?EdNo=001&Info=0282991">
						<img border="0" src="../images/Buttons/Save-Link.gif" width="53" height="11"></a><br>
						</td>
					</tr>
					<tr>
						<td bgcolor="#D7EBFF" style="border-bottom-style: solid; border-bottom-width: 1" colspan="7">
						<img border="0" src="http://www.FreedomsPhoenix.com/images/Media-Logos/Pix/Declare-Your-Independence-with-Ernest-Hancock---Radio-Show-Pix.jpg" hspace="10" width="139" height="100" align="left">
						<font face="Arial" size="1">Radio/TV Show&nbsp; �&nbsp; 
						<b><a target="_blank" href="http://www.FreedomsPhoenix.com/Subjects/00189-LAST-declare-your-independence-with-ernest-hancock.htm">
						<font color="#3234CD">Declare Your Independence with Ernest Hancock</font></a></b></font><br>
						<b>
						<a target="_blank" href="http://www.freedomsphoenix.com/Program-Page.htm?No=0001">
						<font face="Arial" color="#3234CD">Declare Your Independence with Ernest Hancock - Radio</font></a></b><br>
						
						<font face="Arial" size="2">Host: <b><a target="_blank" href="Writer-Bio-Page.htm?EditNo=001">
						<font color="#3234CD" face="Arial" size="2">Ernest Hancock</font></a></b></font><br>
						<a href="http://www.FreedomsPhoenix.com/Media/158428-2014-06-27-06-27-14-lauren-canario-jim-johnson-scott-bieser-tarrin.htm">
						<b><font face="Arial" size="4" color="#3234CD">06-27-14 -- Lauren Canario, Jim Johnson - Scott Bieser - Tarrin Lupo - Josie -Tom Hunt (MP3 LOADED)</font></b></a><br>
						<font face="Arial" size="2">Program Date:&nbsp; <b>2014-06-27</b></font><br>
						<font face="Arial" size="2">&nbsp;&nbsp; Lauren Canario and Jim Johnson on activism - Scott Bieser (BigHeadPress) gives an update - Tarrin Lupo (Author, Activist) tells us what he has been doing - Josie the Outlaw talks about spreading the liberty message - Tom Hunt (MadBitcoins.Com) on cry</font></td>
					</tr>
					<tr>
						<td width="456" colspan="7" bgcolor="#D7EBFF" style="border-top-style: none; border-top-width: medium; border-bottom-style: solid; border-bottom-width: 1" align="center">
						<a target="_blank" href="Add-Comment.htm?EdNo=001&Type=Media&Info=158428">
						<img border="0" src="../images/Buttons/Make-a-Comment.gif" width="81" height="11"></a>
						<font face="Arial" size="2" color="#3234CD">�</font>
						<a href="/Email-Story.htm?EdNo=001&Info=0281730">
						<img border="0" src="../images/Buttons/Email-Link.gif" width="57" height="11"></a>
						<font face="Arial" size="2" color="#3234CD">�</font>
						<a target="_blank" href="Add-Letter.htm?EdNo=001&Info=0281730">
						<img border="0" src="../images/Buttons/Send-Letter-to-Editor.gif" width="92" height="11"></a>
						<font face="Arial" size="2" color="#3234CD">�</font>
						<a target="_blank" href="Save-Link.htm?EdNo=001&Info=0281730">
						<img border="0" src="../images/Buttons/Save-Link.gif" width="53" height="11"></a><br>
						</td>
					</tr>
					<tr>
						<td style="border-bottom-style: solid; border-bottom-width: 1" bgcolor="#FFFFFF" align="center" height="80" colspan="7">
<a href="http://www.FreedomsPhoenix.com/SendTo.htm?AdNo=0039&EdNo=220" target="_blank"><img src="_Ads/Graphics/ASCT-Ban-Ad-2.jpg" width="468" height="60" border="0" alt=""></a>						</td>
					</tr>
					<tr>
						<td bgcolor="#D7EBFF" style="border-bottom-style: solid; border-bottom-width: 1" colspan="7">
						<img border="0" src="http://www.FreedomsPhoenix.com/images/Media-Logos/Pix/Declare-Your-Independence-with-Ernest-Hancock---Radio-Show-Pix.jpg" hspace="10" width="139" height="100" align="left">
						<font face="Arial" size="1">Radio/TV Show&nbsp; �&nbsp; 
						<b><a target="_blank" href="http://www.FreedomsPhoenix.com/Subjects/00189-LAST-declare-your-independence-with-ernest-hancock.htm">
						<font color="#3234CD">Declare Your Independence with Ernest Hancock</font></a></b></font><br>
						<b>
						<a target="_blank" href="http://www.freedomsphoenix.com/Program-Page.htm?No=0001">
						<font face="Arial" color="#3234CD">Declare Your Independence with Ernest Hancock - Radio</font></a></b><br>
						
						<font face="Arial" size="2">Host: <b><a target="_blank" href="Writer-Bio-Page.htm?EditNo=001">
						<font color="#3234CD" face="Arial" size="2">Ernest Hancock</font></a></b></font><br>
						<a href="http://www.FreedomsPhoenix.com/Media/158332-2014-06-26-06-26-14-moe-kinney-derrick-j-james-babb-larken.htm">
						<b><font face="Arial" size="4" color="#3234CD">06-26-14 -- Moe Kinney - Derrick J - James Babb - Larken Rose - FROM PORCFEST (MP3 LOADED)</font></b></a><br>
						<font face="Arial" size="2">Program Date:&nbsp; <b>2014-06-26</b></font><br>
						<font face="Arial" size="2">&nbsp;&nbsp; Moe Kinney (Vermonters for Liberty) on the Freedom & Unity Festival - Derrick J Freeman sits in with Ernest to talk about prepping/surviving the collapse - James Babb talks about activism and having fun doing it - Larken Rose comes on the show to tal</font></td>
					</tr>
					<tr>
						<td width="456" colspan="7" bgcolor="#D7EBFF" style="border-top-style: none; border-top-width: medium; border-bottom-style: solid; border-bottom-width: 1" align="center">
						<a target="_blank" href="Add-Comment.htm?EdNo=001&Type=Media&Info=158332">
						<img border="0" src="../images/Buttons/Make-a-Comment.gif" width="81" height="11"></a>
						<font face="Arial" size="2" color="#3234CD">�</font>
						<a href="/Email-Story.htm?EdNo=001&Info=0281542">
						<img border="0" src="../images/Buttons/Email-Link.gif" width="57" height="11"></a>
						<font face="Arial" size="2" color="#3234CD">�</font>
						<a target="_blank" href="Add-Letter.htm?EdNo=001&Info=0281542">
						<img border="0" src="../images/Buttons/Send-Letter-to-Editor.gif" width="92" height="11"></a>
						<font face="Arial" size="2" color="#3234CD">�</font>
						<a target="_blank" href="Save-Link.htm?EdNo=001&Info=0281542">
						<img border="0" src="../images/Buttons/Save-Link.gif" width="53" height="11"></a><br>
						</td>
					</tr>
					<tr>
						<td bgcolor="#D7EBFF" style="border-bottom-style: solid; border-bottom-width: 1" colspan="7">
						<img border="0" src="http://www.FreedomsPhoenix.com/images/Media-Logos/Pix/Declare-Your-Independence-with-Ernest-Hancock---Radio-Show-Pix.jpg" hspace="10" width="139" height="100" align="left">
						<font face="Arial" size="1">Radio/TV Show&nbsp; �&nbsp; 
						<b><a target="_blank" href="http://www.FreedomsPhoenix.com/Subjects/00189-LAST-declare-your-independence-with-ernest-hancock.htm">
						<font color="#3234CD">Declare Your Independence with Ernest Hancock</font></a></b></font><br>
						<b>
						<a target="_blank" href="http://www.freedomsphoenix.com/Program-Page.htm?No=0001">
						<font face="Arial" color="#3234CD">Declare Your Independence with Ernest Hancock - Radio</font></a></b><br>
						
						<font face="Arial" size="2">Host: <b><a target="_blank" href="Writer-Bio-Page.htm?EditNo=001">
						<font color="#3234CD" face="Arial" size="2">Ernest Hancock</font></a></b></font><br>
						<a href="http://www.FreedomsPhoenix.com/Media/158254-2014-06-25-06-25-14-pete-eyre-tim-frey-bill-buppert-live.htm">
						<b><font face="Arial" size="4" color="#3234CD">06-25-14 -- Pete Eyre - Tim Frey - Bill Buppert -- LIVE FROM PORCFEST 2014 (MP3 LOADED)</font></b></a><br>
						<font face="Arial" size="2">Program Date:&nbsp; <b>2014-06-25</b></font><br>
						<font face="Arial" size="2">&nbsp;&nbsp; Pete Eyre (CopBlock.Org) provides us an update on what he has been doing - Tim Frey (Roberts & Roberts) on supporting Liberty Projects - Bill Buppert (Publisher of ZeroGov.Com) on surviving the collapse</font></td>
					</tr>
					<tr>
						<td width="456" colspan="7" bgcolor="#D7EBFF" style="border-top-style: none; border-top-width: medium; border-bottom-style: solid; border-bottom-width: 1" align="center">
						<a target="_blank" href="Add-Comment.htm?EdNo=001&Type=Media&Info=158254">
						<img border="0" src="../images/Buttons/Make-a-Comment.gif" width="81" height="11"></a>
						<font face="Arial" size="2" color="#3234CD">�</font>
						<a href="/Email-Story.htm?EdNo=001&Info=0281381">
						<img border="0" src="../images/Buttons/Email-Link.gif" width="57" height="11"></a>
						<font face="Arial" size="2" color="#3234CD">�</font>
						<a target="_blank" href="Add-Letter.htm?EdNo=001&Info=0281381">
						<img border="0" src="../images/Buttons/Send-Letter-to-Editor.gif" width="92" height="11"></a>
						<font face="Arial" size="2" color="#3234CD">�</font>
						<a target="_blank" href="Save-Link.htm?EdNo=001&Info=0281381">
						<img border="0" src="../images/Buttons/Save-Link.gif" width="53" height="11"></a><br>
						</td>
					</tr>
					<tr>
						<td bgcolor="#D7EBFF" style="border-bottom-style: solid; border-bottom-width: 1" colspan="7">
						<img border="0" src="http://www.FreedomsPhoenix.com/images/Media-Logos/Pix/Declare-Your-Independence-with-Ernest-Hancock---Radio-Show-Pix.jpg" hspace="10" width="139" height="100" align="left">
						<font face="Arial" size="1">Radio/TV Show&nbsp; �&nbsp; 
						<b><a target="_blank" href="http://www.FreedomsPhoenix.com/Subjects/00189-LAST-declare-your-independence-with-ernest-hancock.htm">
						<font color="#3234CD">Declare Your Independence with Ernest Hancock</font></a></b></font><br>
						<b>
						<a target="_blank" href="http://www.freedomsphoenix.com/Program-Page.htm?No=0001">
						<font face="Arial" color="#3234CD">Declare Your Independence with Ernest Hancock - Radio</font></a></b><br>
						
						<font face="Arial" size="2">Host: <b><a target="_blank" href="Writer-Bio-Page.htm?EditNo=001">
						<font color="#3234CD" face="Arial" size="2">Ernest Hancock</font></a></b></font><br>
						<a href="http://www.FreedomsPhoenix.com/Media/158177-2014-06-24-06-24-14-liz-jones-david-ridler-lynn-ulbricht-carla.htm">
						<b><font face="Arial" size="4" color="#3234CD">06-24-14 -- Liz Jones - David Ridler - Lynn Ulbricht - Carla Gericke - Crosby Peck - (MP3 LOADED)</font></b></a><br>
						<font face="Arial" size="2">Program Date:&nbsp; <b>2014-06-24</b></font><br>
						<font face="Arial" size="2">&nbsp;&nbsp; Liz Jones (r3VOLutionary) on Eric Cantor losing re-election - David Ridler (activist from Michigan) says hello - Lynn Ulbricht (mother of Dread Pirate Roberts, Ross Ulbricht) on her plight to get her son out of jail - Carla Gericke (Pres FSP) on Porc</font></td>
					</tr>
					<tr>
						<td width="456" colspan="7" bgcolor="#D7EBFF" style="border-top-style: none; border-top-width: medium; border-bottom-style: solid; border-bottom-width: 1" align="center">
						<a target="_blank" href="Add-Comment.htm?EdNo=001&Type=Media&Info=158177">
						<img border="0" src="../images/Buttons/Make-a-Comment.gif" width="81" height="11"></a>
						<font face="Arial" size="2" color="#3234CD">�</font>
						<a href="/Email-Story.htm?EdNo=001&Info=0281243">
						<img border="0" src="../images/Buttons/Email-Link.gif" width="57" height="11"></a>
						<font face="Arial" size="2" color="#3234CD">�</font>
						<a target="_blank" href="Add-Letter.htm?EdNo=001&Info=0281243">
						<img border="0" src="../images/Buttons/Send-Letter-to-Editor.gif" width="92" height="11"></a>
						<font face="Arial" size="2" color="#3234CD">�</font>
						<a target="_blank" href="Save-Link.htm?EdNo=001&Info=0281243">
						<img border="0" src="../images/Buttons/Save-Link.gif" width="53" height="11"></a><br>
						</td>
					</tr>
					<tr>
						<td bgcolor="#D7EBFF" style="border-bottom-style: solid; border-bottom-width: 1" colspan="7">
						<img border="0" src="http://www.FreedomsPhoenix.com/images/Media-Logos/Pix/Declare-Your-Independence-with-Ernest-Hancock---Radio-Show-Pix.jpg" hspace="10" width="139" height="100" align="left">
						<font face="Arial" size="1">Radio/TV Show&nbsp; �&nbsp; 
						<b><a target="_blank" href="http://www.FreedomsPhoenix.com/Subjects/00189-LAST-declare-your-independence-with-ernest-hancock.htm">
						<font color="#3234CD">Declare Your Independence with Ernest Hancock</font></a></b></font><br>
						<b>
						<a target="_blank" href="http://www.freedomsphoenix.com/Program-Page.htm?No=0001">
						<font face="Arial" color="#3234CD">Declare Your Independence with Ernest Hancock - Radio</font></a></b><br>
						
						<font face="Arial" size="2">Host: <b><a target="_blank" href="Writer-Bio-Page.htm?EditNo=001">
						<font color="#3234CD" face="Arial" size="2">Ernest Hancock</font></a></b></font><br>
						<a href="http://www.FreedomsPhoenix.com/Media/158066-2014-06-23-06-23-14-ian-freeman-richard-grove-lisa-arbercheski-mp3.htm">
						<b><font face="Arial" size="4" color="#3234CD">06-23-14 -- Ian Freeman - Richard Grove, Lisa Arbercheski - (MP3 LOADED)</font></b></a><br>
						<font face="Arial" size="2">Program Date:&nbsp; <b>2014-06-23</b></font><br>
						<font face="Arial" size="2">&nbsp;&nbsp; Ian Freeman (owner of LRN.FM) does a segment as a sponsor of Porcfest...Donna Hancock sits in for a segment to help kick off the show - Richard Grove and Lisa Arbercheski (Tragedy and Hope) come on the show to talk about activism, education, and what</font></td>
					</tr>
					<tr>
						<td width="456" colspan="7" bgcolor="#D7EBFF" style="border-top-style: none; border-top-width: medium; border-bottom-style: solid; border-bottom-width: 1" align="center">
						<a target="_blank" href="Add-Comment.htm?EdNo=001&Type=Media&Info=158066">
						<img border="0" src="../images/Buttons/Make-a-Comment.gif" width="81" height="11"></a>
						<font face="Arial" size="2" color="#3234CD">�</font>
						<a href="/Email-Story.htm?EdNo=001&Info=0281023">
						<img border="0" src="../images/Buttons/Email-Link.gif" width="57" height="11"></a>
						<font face="Arial" size="2" color="#3234CD">�</font>
						<a target="_blank" href="Add-Letter.htm?EdNo=001&Info=0281023">
						<img border="0" src="../images/Buttons/Send-Letter-to-Editor.gif" width="92" height="11"></a>
						<font face="Arial" size="2" color="#3234CD">�</font>
						<a target="_blank" href="Save-Link.htm?EdNo=001&Info=0281023">
						<img border="0" src="../images/Buttons/Save-Link.gif" width="53" height="11"></a><br>
						</td>
					</tr>
					<tr>
						<td bgcolor="#D7EBFF" style="border-bottom-style: solid; border-bottom-width: 1" colspan="7">
						<img border="0" src="http://www.FreedomsPhoenix.com/images/Media-Logos/Pix/Declare-Your-Independence-with-Ernest-Hancock---Radio-Show-Pix.jpg" hspace="10" width="139" height="100" align="left">
						<font face="Arial" size="1">Radio/TV Show&nbsp; �&nbsp; 
						<b><a target="_blank" href="http://www.FreedomsPhoenix.com/Subjects/00189-LAST-declare-your-independence-with-ernest-hancock.htm">
						<font color="#3234CD">Declare Your Independence with Ernest Hancock</font></a></b></font><br>
						<b>
						<a target="_blank" href="http://www.freedomsphoenix.com/Program-Page.htm?No=0001">
						<font face="Arial" color="#3234CD">Declare Your Independence with Ernest Hancock - Radio</font></a></b><br>
						
						<font face="Arial" size="2">Host: <b><a target="_blank" href="Writer-Bio-Page.htm?EditNo=001">
						<font color="#3234CD" face="Arial" size="2">Ernest Hancock</font></a></b></font><br>
						<a href="http://www.FreedomsPhoenix.com/Media/157890-2014-06-20-06-20-14-scott-horton-francis-boyle-video-mp3-loaded.htm">
						<b><font face="Arial" size="4" color="#3234CD">06-20-14 -- Scott Horton - Francis Boyle - (VIDEO & MP3 LOADED)</font></b></a><br>
						<font face="Arial" size="2">Program Date:&nbsp; <b>2014-06-20</b></font><br>
						<font face="Arial" size="2">&nbsp;&nbsp; Ernest goes over the headline news on Freedom's Phoenix - Scott Horton (talk show host, anti-war activist) joins the show to discuss the Middle East - Francis Boyle (Professor Int'l Law Univ of Illinois) discusses the War Powers Resolution; Attack on</font></td>
					</tr>
					<tr>
						<td width="456" colspan="7" bgcolor="#D7EBFF" style="border-top-style: none; border-top-width: medium; border-bottom-style: solid; border-bottom-width: 1" align="center">
						<a target="_blank" href="Add-Comment.htm?EdNo=001&Type=Media&Info=157890">
						<img border="0" src="../images/Buttons/Make-a-Comment.gif" width="81" height="11"></a>
						<font face="Arial" size="2" color="#3234CD">�</font>
						<a href="/Email-Story.htm?EdNo=001&Info=0280683">
						<img border="0" src="../images/Buttons/Email-Link.gif" width="57" height="11"></a>
						<font face="Arial" size="2" color="#3234CD">�</font>
						<a target="_blank" href="Add-Letter.htm?EdNo=001&Info=0280683">
						<img border="0" src="../images/Buttons/Send-Letter-to-Editor.gif" width="92" height="11"></a>
						<font face="Arial" size="2" color="#3234CD">�</font>
						<a target="_blank" href="Save-Link.htm?EdNo=001&Info=0280683">
						<img border="0" src="../images/Buttons/Save-Link.gif" width="53" height="11"></a><br>
						</td>
					</tr>
					<tr>
						<td bgcolor="#D7EBFF" style="border-bottom-style: solid; border-bottom-width: 1" colspan="7">
						<img border="0" src="http://www.FreedomsPhoenix.com/images/Media-Logos/Pix/Declare-Your-Independence-with-Ernest-Hancock---Radio-Show-Pix.jpg" hspace="10" width="139" height="100" align="left">
						<font face="Arial" size="1">Radio/TV Show&nbsp; �&nbsp; 
						<b><a target="_blank" href="http://www.FreedomsPhoenix.com/Subjects/00189-LAST-declare-your-independence-with-ernest-hancock.htm">
						<font color="#3234CD">Declare Your Independence with Ernest Hancock</font></a></b></font><br>
						<b>
						<a target="_blank" href="http://www.freedomsphoenix.com/Program-Page.htm?No=0001">
						<font face="Arial" color="#3234CD">Declare Your Independence with Ernest Hancock - Radio</font></a></b><br>
						
						<font face="Arial" size="2">Host: <b><a target="_blank" href="Writer-Bio-Page.htm?EditNo=001">
						<font color="#3234CD" face="Arial" size="2">Ernest Hancock</font></a></b></font><br>
						<a href="http://www.FreedomsPhoenix.com/Media/157814-2014-06-19-06-19-14-reed-jessen-stephan-kinsella-jordan-page-adam.htm">
						<b><font face="Arial" size="4" color="#3234CD">06-19-14 -- Reed Jessen & Stephan Kinsella - Jordan Page - Adam Kokesh (MP3 & VIDEO LOADED)</font></b></a><br>
						<font face="Arial" size="2">Program Date:&nbsp; <b>2014-06-19</b></font><br>
						<font face="Arial" size="2">&nbsp;&nbsp; Reed Jessen (Founder of The Cryptocurrency Defense Foundation) on defending the cryptocurrency economy - Jordan Page (Songwriter, Musician, Activist) provides an update - Adam Kokesh (AdamVsTheMan) talks about his recent conviction and what's next</font></td>
					</tr>
					<tr>
						<td width="456" colspan="7" bgcolor="#D7EBFF" style="border-top-style: none; border-top-width: medium; border-bottom-style: solid; border-bottom-width: 1" align="center">
						<a target="_blank" href="Add-Comment.htm?EdNo=001&Type=Media&Info=157814">
						<img border="0" src="../images/Buttons/Make-a-Comment.gif" width="81" height="11"></a>
						<font face="Arial" size="2" color="#3234CD">�</font>
						<a href="/Email-Story.htm?EdNo=001&Info=0280531">
						<img border="0" src="../images/Buttons/Email-Link.gif" width="57" height="11"></a>
						<font face="Arial" size="2" color="#3234CD">�</font>
						<a target="_blank" href="Add-Letter.htm?EdNo=001&Info=0280531">
						<img border="0" src="../images/Buttons/Send-Letter-to-Editor.gif" width="92" height="11"></a>
						<font face="Arial" size="2" color="#3234CD">�</font>
						<a target="_blank" href="Save-Link.htm?EdNo=001&Info=0280531">
						<img border="0" src="../images/Buttons/Save-Link.gif" width="53" height="11"></a><br>
						</td>
					</tr>
					<tr>
						<td bgcolor="#D7EBFF" style="border-bottom-style: solid; border-bottom-width: 1" colspan="7">
						<img border="0" src="http://www.FreedomsPhoenix.com/images/Media-Logos/Pix/Declare-Your-Independence-with-Ernest-Hancock---Radio-Show-Pix.jpg" hspace="10" width="139" height="100" align="left">
						<font face="Arial" size="1">Radio/TV Show&nbsp; �&nbsp; 
						<b><a target="_blank" href="http://www.FreedomsPhoenix.com/Subjects/00189-LAST-declare-your-independence-with-ernest-hancock.htm">
						<font color="#3234CD">Declare Your Independence with Ernest Hancock</font></a></b></font><br>
						<b>
						<a target="_blank" href="http://www.freedomsphoenix.com/Program-Page.htm?No=0001">
						<font face="Arial" color="#3234CD">Declare Your Independence with Ernest Hancock - Radio</font></a></b><br>
						
						<font face="Arial" size="2">Host: <b><a target="_blank" href="Writer-Bio-Page.htm?EditNo=001">
						<font color="#3234CD" face="Arial" size="2">Ernest Hancock</font></a></b></font><br>
						<a href="http://www.FreedomsPhoenix.com/Media/157741-2014-06-18-06-18-14-bill-binney-nsa-whisleblower-mp3-video-loaded.htm">
						<b><font face="Arial" size="4" color="#3234CD">06-18-14 -- Bill Binney - NSA Whisleblower (MP3 & VIDEO LOADED)</font></b></a><br>
						<font face="Arial" size="2">Program Date:&nbsp; <b>2014-06-18</b></font><br>
						<font face="Arial" size="2">&nbsp;&nbsp; Bill Binney (former NSA crypto-mathematician, applying mathematical discipline to datavcollection, analysis and reporting) blew the whistle on the NSA's mis-management of their information processing system that costs lives</font></td>
					</tr>
					<tr>
						<td width="456" colspan="7" bgcolor="#D7EBFF" style="border-top-style: none; border-top-width: medium; border-bottom-style: solid; border-bottom-width: 1" align="center">
						<a target="_blank" href="Add-Comment.htm?EdNo=001&Type=Media&Info=157741">
						<img border="0" src="../images/Buttons/Make-a-Comment.gif" width="81" height="11"></a>
						<font face="Arial" size="2" color="#3234CD">�</font>
						<a href="/Email-Story.htm?EdNo=001&Info=0280397">
						<img border="0" src="../images/Buttons/Email-Link.gif" width="57" height="11"></a>
						<font face="Arial" size="2" color="#3234CD">�</font>
						<a target="_blank" href="Add-Letter.htm?EdNo=001&Info=0280397">
						<img border="0" src="../images/Buttons/Send-Letter-to-Editor.gif" width="92" height="11"></a>
						<font face="Arial" size="2" color="#3234CD">�</font>
						<a target="_blank" href="Save-Link.htm?EdNo=001&Info=0280397">
						<img border="0" src="../images/Buttons/Save-Link.gif" width="53" height="11"></a><br>
						</td>
					</tr>
					<tr>
						<td bgcolor="#D7EBFF" style="border-bottom-style: solid; border-bottom-width: 1" colspan="7">
						<img border="0" src="http://www.FreedomsPhoenix.com/images/Media-Logos/Pix/Declare-Your-Independence-with-Ernest-Hancock---Radio-Show-Pix.jpg" hspace="10" width="139" height="100" align="left">
						<font face="Arial" size="1">Radio/TV Show&nbsp; �&nbsp; 
						<b><a target="_blank" href="http://www.FreedomsPhoenix.com/Subjects/00189-LAST-declare-your-independence-with-ernest-hancock.htm">
						<font color="#3234CD">Declare Your Independence with Ernest Hancock</font></a></b></font><br>
						<b>
						<a target="_blank" href="http://www.freedomsphoenix.com/Program-Page.htm?No=0001">
						<font face="Arial" color="#3234CD">Declare Your Independence with Ernest Hancock - Radio</font></a></b><br>
						
						<font face="Arial" size="2">Host: <b><a target="_blank" href="Writer-Bio-Page.htm?EditNo=001">
						<font color="#3234CD" face="Arial" size="2">Ernest Hancock</font></a></b></font><br>
						<a href="http://www.FreedomsPhoenix.com/Media/157661-2014-06-17-06-17-14-carla-gericke-keith-cyrnek-video-mp3-loaded.htm">
						<b><font face="Arial" size="4" color="#3234CD">06-17-14 -- Carla Gericke - Keith Cyrnek - (VIDEO & MP3 LOADED + Carla Bonus)</font></b></a><br>
						<font face="Arial" size="2">Program Date:&nbsp; <b>2014-06-17</b></font><br>
						<font face="Arial" size="2">&nbsp;&nbsp; Keith Cyrnek (local activist) stops by the studio and sits in with Ernest for a few segments - Carla Gericke (President of the Free State Project) comes on the show to talk about the lawsuit she won on charges of illegal wiretapping </font></td>
					</tr>
					<tr>
						<td width="456" colspan="7" bgcolor="#D7EBFF" style="border-top-style: none; border-top-width: medium; border-bottom-style: solid; border-bottom-width: 1" align="center">
						<a target="_blank" href="Add-Comment.htm?EdNo=001&Type=Media&Info=157661">
						<img border="0" src="../images/Buttons/Make-a-Comment.gif" width="81" height="11"></a>
						<font face="Arial" size="2" color="#3234CD">�</font>
						<a href="/Email-Story.htm?EdNo=001&Info=0280212">
						<img border="0" src="../images/Buttons/Email-Link.gif" width="57" height="11"></a>
						<font face="Arial" size="2" color="#3234CD">�</font>
						<a target="_blank" href="Add-Letter.htm?EdNo=001&Info=0280212">
						<img border="0" src="../images/Buttons/Send-Letter-to-Editor.gif" width="92" height="11"></a>
						<font face="Arial" size="2" color="#3234CD">�</font>
						<a target="_blank" href="Save-Link.htm?EdNo=001&Info=0280212">
						<img border="0" src="../images/Buttons/Save-Link.gif" width="53" height="11"></a><br>
						</td>
					</tr>
					<tr>
						<td style="border-bottom-style: solid; border-bottom-width: 1" bgcolor="#FFFFFF" align="center" height="80" colspan="7">
<a href="http://www.FreedomsPhoenix.com/SendTo.htm?AdNo=1251&EdNo=220" target="_blank"><img src="_Ads/Graphics/Mike-Wasdin-003.gif" width="728" height="90" border="0" alt="Attorney For Freedom"></a>						</td>
					</tr>
					<tr>
						<td bgcolor="#D7EBFF" style="border-bottom-style: solid; border-bottom-width: 1" colspan="7">
						<img border="0" src="http://www.FreedomsPhoenix.com/images/Media-Logos/Pix/Declare-Your-Independence-with-Ernest-Hancock---Radio-Show-Pix.jpg" hspace="10" width="139" height="100" align="left">
						<font face="Arial" size="1">Radio/TV Show&nbsp; �&nbsp; 
						<b><a target="_blank" href="http://www.FreedomsPhoenix.com/Subjects/00189-LAST-declare-your-independence-with-ernest-hancock.htm">
						<font color="#3234CD">Declare Your Independence with Ernest Hancock</font></a></b></font><br>
						<b>
						<a target="_blank" href="http://www.freedomsphoenix.com/Program-Page.htm?No=0001">
						<font face="Arial" color="#3234CD">Declare Your Independence with Ernest Hancock - Radio</font></a></b><br>
						
						<font face="Arial" size="2">Host: <b><a target="_blank" href="Writer-Bio-Page.htm?EditNo=001">
						<font color="#3234CD" face="Arial" size="2">Ernest Hancock</font></a></b></font><br>
						<a href="http://www.FreedomsPhoenix.com/Media/157482-2014-06-13-06-13-14-tarrin-lupo-tim-frey-angel-clark-video.htm">
						<b><font face="Arial" size="4" color="#3234CD">06-13-14 -- Tarrin Lupo - Tim Frey - Angel Clark (VIDEO & MP3 LOADED)</font></b></a><br>
						<font face="Arial" size="2">Program Date:&nbsp; <b>2014-06-13</b></font><br>
						<font face="Arial" size="2">&nbsp;&nbsp; Tarrin Lupo (Author, Agorist) updates us on what he is doing - Tim Frey (President Roberts & Roberts Brokerage, Inc) on Bitcoin, Precious Metals, Porcfest 2014 - Angel Clark (talk show host, activist) talks to Ernest about the news, social media, etc</font></td>
					</tr>
					<tr>
						<td width="456" colspan="7" bgcolor="#D7EBFF" style="border-top-style: none; border-top-width: medium; border-bottom-style: solid; border-bottom-width: 1" align="center">
						<a target="_blank" href="Add-Comment.htm?EdNo=001&Type=Media&Info=157482">
						<img border="0" src="../images/Buttons/Make-a-Comment.gif" width="81" height="11"></a>
						<font face="Arial" size="2" color="#3234CD">�</font>
						<a href="/Email-Story.htm?EdNo=001&Info=0279856">
						<img border="0" src="../images/Buttons/Email-Link.gif" width="57" height="11"></a>
						<font face="Arial" size="2" color="#3234CD">�</font>
						<a target="_blank" href="Add-Letter.htm?EdNo=001&Info=0279856">
						<img border="0" src="../images/Buttons/Send-Letter-to-Editor.gif" width="92" height="11"></a>
						<font face="Arial" size="2" color="#3234CD">�</font>
						<a target="_blank" href="Save-Link.htm?EdNo=001&Info=0279856">
						<img border="0" src="../images/Buttons/Save-Link.gif" width="53" height="11"></a><br>
						</td>
					</tr>
					<tr>
						<td bgcolor="#D7EBFF" style="border-bottom-style: solid; border-bottom-width: 1" colspan="7">
						<img border="0" src="http://www.FreedomsPhoenix.com/images/Media-Logos/Pix/Declare-Your-Independence-with-Ernest-Hancock---Radio-Show-Pix.jpg" hspace="10" width="139" height="100" align="left">
						<font face="Arial" size="1">Radio/TV Show&nbsp; �&nbsp; 
						<b><a target="_blank" href="http://www.FreedomsPhoenix.com/Subjects/00189-LAST-declare-your-independence-with-ernest-hancock.htm">
						<font color="#3234CD">Declare Your Independence with Ernest Hancock</font></a></b></font><br>
						<b>
						<a target="_blank" href="http://www.freedomsphoenix.com/Program-Page.htm?No=0001">
						<font face="Arial" color="#3234CD">Declare Your Independence with Ernest Hancock - Radio</font></a></b><br>
						
						<font face="Arial" size="2">Host: <b><a target="_blank" href="Writer-Bio-Page.htm?EditNo=001">
						<font color="#3234CD" face="Arial" size="2">Ernest Hancock</font></a></b></font><br>
						<a href="http://www.FreedomsPhoenix.com/Media/157398-2014-06-12-06-12-14-carlos-miller-meghan-kellison-mp3-video-loaded.htm">
						<b><font face="Arial" size="4" color="#3234CD">06-12-14 -- Carlos Miller - Meghan Kellison (MP3 & VIDEO LOADED)</font></b></a><br>
						<font face="Arial" size="2">Program Date:&nbsp; <b>2014-06-12</b></font><br>
						<font face="Arial" size="2">&nbsp;&nbsp; Carlos Miller (Photography is Not a Crime) talks about his new book, The Citizen Journalist's Photography Handbook - Meghan Kellison (BitcoinNotBombs.Com) on the Bitcoin in the Beltway conference - Tim Frey (Roberts & Roberts) on Bitcoin, Precious Me</font></td>
					</tr>
					<tr>
						<td width="456" colspan="7" bgcolor="#D7EBFF" style="border-top-style: none; border-top-width: medium; border-bottom-style: solid; border-bottom-width: 1" align="center">
						<a target="_blank" href="Add-Comment.htm?EdNo=001&Type=Media&Info=157398">
						<img border="0" src="../images/Buttons/Make-a-Comment.gif" width="81" height="11"></a>
						<font face="Arial" size="2" color="#3234CD">�</font>
						<a href="/Email-Story.htm?EdNo=001&Info=0279683">
						<img border="0" src="../images/Buttons/Email-Link.gif" width="57" height="11"></a>
						<font face="Arial" size="2" color="#3234CD">�</font>
						<a target="_blank" href="Add-Letter.htm?EdNo=001&Info=0279683">
						<img border="0" src="../images/Buttons/Send-Letter-to-Editor.gif" width="92" height="11"></a>
						<font face="Arial" size="2" color="#3234CD">�</font>
						<a target="_blank" href="Save-Link.htm?EdNo=001&Info=0279683">
						<img border="0" src="../images/Buttons/Save-Link.gif" width="53" height="11"></a><br>
						</td>
					</tr>
					<tr>
						<td bgcolor="#D7EBFF" style="border-bottom-style: solid; border-bottom-width: 1" colspan="7">
						<img border="0" src="http://www.FreedomsPhoenix.com/images/Media-Logos/Pix/Declare-Your-Independence-with-Ernest-Hancock---Radio-Show-Pix.jpg" hspace="10" width="139" height="100" align="left">
						<font face="Arial" size="1">Radio/TV Show&nbsp; �&nbsp; 
						<b><a target="_blank" href="http://www.FreedomsPhoenix.com/Subjects/00189-LAST-declare-your-independence-with-ernest-hancock.htm">
						<font color="#3234CD">Declare Your Independence with Ernest Hancock</font></a></b></font><br>
						<b>
						<a target="_blank" href="http://www.freedomsphoenix.com/Program-Page.htm?No=0001">
						<font face="Arial" color="#3234CD">Declare Your Independence with Ernest Hancock - Radio</font></a></b><br>
						
						<font face="Arial" size="2">Host: <b><a target="_blank" href="Writer-Bio-Page.htm?EditNo=001">
						<font color="#3234CD" face="Arial" size="2">Ernest Hancock</font></a></b></font><br>
						<a href="http://www.FreedomsPhoenix.com/Media/157356-2014-06-11-06-11-14-monika-wesolowski-jason-king-tatiana-moroz-mp3.htm">
						<b><font face="Arial" size="4" color="#3234CD">06-11-14 -- Monika Wesolowski - Jason King - Tatiana Moroz (MP3 & VIDEO LOADED)</font></b></a><br>
						<font face="Arial" size="2">Program Date:&nbsp; <b>2014-06-11</b></font><br>
						<font face="Arial" size="2">&nbsp;&nbsp; Monika Wesolowski comes on the show to tell her story of CPS abducting her child - Jason King (SeansOutpost.Com) comes on to promote Bitcoin In The Beltway 2014 - Tatiana Moroz (Songwriter, Musician) on Tatiana Coin, Porcfest 2014</font></td>
					</tr>
					<tr>
						<td width="456" colspan="7" bgcolor="#D7EBFF" style="border-top-style: none; border-top-width: medium; border-bottom-style: solid; border-bottom-width: 1" align="center">
						<a target="_blank" href="Add-Comment.htm?EdNo=001&Type=Media&Info=157356">
						<img border="0" src="../images/Buttons/Make-a-Comment.gif" width="81" height="11"></a>
						<font face="Arial" size="2" color="#3234CD">�</font>
						<a href="/Email-Story.htm?EdNo=001&Info=0279602">
						<img border="0" src="../images/Buttons/Email-Link.gif" width="57" height="11"></a>
						<font face="Arial" size="2" color="#3234CD">�</font>
						<a target="_blank" href="Add-Letter.htm?EdNo=001&Info=0279602">
						<img border="0" src="../images/Buttons/Send-Letter-to-Editor.gif" width="92" height="11"></a>
						<font face="Arial" size="2" color="#3234CD">�</font>
						<a target="_blank" href="Save-Link.htm?EdNo=001&Info=0279602">
						<img border="0" src="../images/Buttons/Save-Link.gif" width="53" height="11"></a><br>
						</td>
					</tr>
					<tr>
						<td bgcolor="#D7EBFF" style="border-bottom-style: solid; border-bottom-width: 1" colspan="7">
						<img border="0" src="http://www.FreedomsPhoenix.com/images/Media-Logos/Pix/Declare-Your-Independence-with-Ernest-Hancock---Radio-Show-Pix.jpg" hspace="10" width="139" height="100" align="left">
						<font face="Arial" size="1">Radio/TV Show&nbsp; �&nbsp; 
						<b><a target="_blank" href="http://www.FreedomsPhoenix.com/Subjects/00189-LAST-declare-your-independence-with-ernest-hancock.htm">
						<font color="#3234CD">Declare Your Independence with Ernest Hancock</font></a></b></font><br>
						<b>
						<a target="_blank" href="http://www.freedomsphoenix.com/Program-Page.htm?No=0001">
						<font face="Arial" color="#3234CD">Declare Your Independence with Ernest Hancock - Radio</font></a></b><br>
						
						<font face="Arial" size="2">Host: <b><a target="_blank" href="Writer-Bio-Page.htm?EditNo=001">
						<font color="#3234CD" face="Arial" size="2">Ernest Hancock</font></a></b></font><br>
						<a href="http://www.FreedomsPhoenix.com/Media/157252-2014-06-10-06-10-14-mike-salvi-freedoms-phoenix-headline-news-video.htm">
						<b><font face="Arial" size="4" color="#3234CD">06-10-14 -- Mike Salvi - Freedom's Phoenix Headline News - (VIDEO & MP3 LOADED)</font></b></a><br>
						<font face="Arial" size="2">Program Date:&nbsp; <b>2014-06-10</b></font><br>
						<font face="Arial" size="2">&nbsp;&nbsp; Mike Salvi (Activist in Philly, host of Mike Salvi's World) comes on the show to talk about what's in the news and to get an update on what he has been doing - Ernest goes over the headline news on Freedom's Phoenix</font></td>
					</tr>
					<tr>
						<td width="456" colspan="7" bgcolor="#D7EBFF" style="border-top-style: none; border-top-width: medium; border-bottom-style: solid; border-bottom-width: 1" align="center">
						<a target="_blank" href="Add-Comment.htm?EdNo=001&Type=Media&Info=157252">
						<img border="0" src="../images/Buttons/Make-a-Comment.gif" width="81" height="11"></a>
						<font face="Arial" size="2" color="#3234CD">�</font>
						<a href="/Email-Story.htm?EdNo=001&Info=0279386">
						<img border="0" src="../images/Buttons/Email-Link.gif" width="57" height="11"></a>
						<font face="Arial" size="2" color="#3234CD">�</font>
						<a target="_blank" href="Add-Letter.htm?EdNo=001&Info=0279386">
						<img border="0" src="../images/Buttons/Send-Letter-to-Editor.gif" width="92" height="11"></a>
						<font face="Arial" size="2" color="#3234CD">�</font>
						<a target="_blank" href="Save-Link.htm?EdNo=001&Info=0279386">
						<img border="0" src="../images/Buttons/Save-Link.gif" width="53" height="11"></a><br>
						</td>
					</tr>
					<tr>
						<td bgcolor="#D7EBFF" style="border-bottom-style: solid; border-bottom-width: 1" colspan="7">
						<img border="0" src="http://www.FreedomsPhoenix.com/images/Media-Logos/Pix/Declare-Your-Independence-with-Ernest-Hancock---Radio-Show-Pix.jpg" hspace="10" width="139" height="100" align="left">
						<font face="Arial" size="1">Radio/TV Show&nbsp; �&nbsp; 
						<b><a target="_blank" href="http://www.FreedomsPhoenix.com/Subjects/00189-LAST-declare-your-independence-with-ernest-hancock.htm">
						<font color="#3234CD">Declare Your Independence with Ernest Hancock</font></a></b></font><br>
						<b>
						<a target="_blank" href="http://www.freedomsphoenix.com/Program-Page.htm?No=0001">
						<font face="Arial" color="#3234CD">Declare Your Independence with Ernest Hancock - Radio</font></a></b><br>
						
						<font face="Arial" size="2">Host: <b><a target="_blank" href="Writer-Bio-Page.htm?EditNo=001">
						<font color="#3234CD" face="Arial" size="2">Ernest Hancock</font></a></b></font><br>
						<a href="http://www.FreedomsPhoenix.com/Media/157071-2014-06-06-06-06-14-allison-bricker-jennifer-jones-mp3-video-loaded.htm">
						<b><font face="Arial" size="4" color="#3234CD">06-06-14 -- Allison Bricker - Jennifer Jones (MP3 & VIDEO LOADED)</font></b></a><br>
						<font face="Arial" size="2">Program Date:&nbsp; <b>2014-06-06</b></font><br>
						<font face="Arial" size="2">&nbsp;&nbsp; Allison Bricker (Station Manager, Daily Paul Radio) provides an update on the pursuit of freedom - Jennifer Jones (owner of �A Fur Salon� and �The Desert Freedom Press�) activist in Quartzsite, AZ talks about her run for Arizona House of Representati</font></td>
					</tr>
					<tr>
						<td width="456" colspan="7" bgcolor="#D7EBFF" style="border-top-style: none; border-top-width: medium; border-bottom-style: solid; border-bottom-width: 1" align="center">
						<a target="_blank" href="Add-Comment.htm?EdNo=001&Type=Media&Info=157071">
						<img border="0" src="../images/Buttons/Make-a-Comment.gif" width="81" height="11"></a>
						<font face="Arial" size="2" color="#3234CD">�</font>
						<a href="/Email-Story.htm?EdNo=001&Info=0279052">
						<img border="0" src="../images/Buttons/Email-Link.gif" width="57" height="11"></a>
						<font face="Arial" size="2" color="#3234CD">�</font>
						<a target="_blank" href="Add-Letter.htm?EdNo=001&Info=0279052">
						<img border="0" src="../images/Buttons/Send-Letter-to-Editor.gif" width="92" height="11"></a>
						<font face="Arial" size="2" color="#3234CD">�</font>
						<a target="_blank" href="Save-Link.htm?EdNo=001&Info=0279052">
						<img border="0" src="../images/Buttons/Save-Link.gif" width="53" height="11"></a><br>
						</td>
					</tr>
					<tr>
						<td bgcolor="#D7EBFF" style="border-bottom-style: solid; border-bottom-width: 1" colspan="7">
						<img border="0" src="http://www.FreedomsPhoenix.com/images/Media-Logos/Pix/Declare-Your-Independence-with-Ernest-Hancock---Radio-Show-Pix.jpg" hspace="10" width="139" height="100" align="left">
						<font face="Arial" size="1">Radio/TV Show&nbsp; �&nbsp; 
						<b><a target="_blank" href="http://www.FreedomsPhoenix.com/Subjects/00189-LAST-declare-your-independence-with-ernest-hancock.htm">
						<font color="#3234CD">Declare Your Independence with Ernest Hancock</font></a></b></font><br>
						<b>
						<a target="_blank" href="http://www.freedomsphoenix.com/Program-Page.htm?No=0001">
						<font face="Arial" color="#3234CD">Declare Your Independence with Ernest Hancock - Radio</font></a></b><br>
						
						<font face="Arial" size="2">Host: <b><a target="_blank" href="Writer-Bio-Page.htm?EditNo=001">
						<font color="#3234CD" face="Arial" size="2">Ernest Hancock</font></a></b></font><br>
						<a href="http://www.FreedomsPhoenix.com/Media/157000-2014-06-05-06-05-14-dr-phranq-tamburri-in-studio-mp3-video.htm">
						<b><font face="Arial" size="4" color="#3234CD">06-05-14 -- Dr. Phranq Tamburri In Studio (MP3 & VIDEO LOADED)</font></b></a><br>
						<font face="Arial" size="2">Program Date:&nbsp; <b>2014-06-05</b></font><br>
						<font face="Arial" size="2">&nbsp;&nbsp; Dr. Phranq Tamburri, NMD (Longevity Medical Center) on Natural Medicine, Obamacare, and how socialized medicine is not going to produce an optimal healthcare system - Dr. Tamburri brings with him 3 senior medical students</font></td>
					</tr>
					<tr>
						<td width="456" colspan="7" bgcolor="#D7EBFF" style="border-top-style: none; border-top-width: medium; border-bottom-style: solid; border-bottom-width: 1" align="center">
						<a target="_blank" href="Add-Comment.htm?EdNo=001&Type=Media&Info=157000">
						<img border="0" src="../images/Buttons/Make-a-Comment.gif" width="81" height="11"></a>
						<font face="Arial" size="2" color="#3234CD">�</font>
						<a href="/Email-Story.htm?EdNo=001&Info=0278935">
						<img border="0" src="../images/Buttons/Email-Link.gif" width="57" height="11"></a>
						<font face="Arial" size="2" color="#3234CD">�</font>
						<a target="_blank" href="Add-Letter.htm?EdNo=001&Info=0278935">
						<img border="0" src="../images/Buttons/Send-Letter-to-Editor.gif" width="92" height="11"></a>
						<font face="Arial" size="2" color="#3234CD">�</font>
						<a target="_blank" href="Save-Link.htm?EdNo=001&Info=0278935">
						<img border="0" src="../images/Buttons/Save-Link.gif" width="53" height="11"></a><br>
						</td>
					</tr>
					<tr>
						<td bgcolor="#D7EBFF" style="border-bottom-style: solid; border-bottom-width: 1" colspan="7">
						<img border="0" src="http://www.FreedomsPhoenix.com/images/Media-Logos/Pix/Declare-Your-Independence-with-Ernest-Hancock---Radio-Show-Pix.jpg" hspace="10" width="139" height="100" align="left">
						<font face="Arial" size="1">Radio/TV Show&nbsp; �&nbsp; 
						<b><a target="_blank" href="http://www.FreedomsPhoenix.com/Subjects/00189-LAST-declare-your-independence-with-ernest-hancock.htm">
						<font color="#3234CD">Declare Your Independence with Ernest Hancock</font></a></b></font><br>
						<b>
						<a target="_blank" href="http://www.freedomsphoenix.com/Program-Page.htm?No=0001">
						<font face="Arial" color="#3234CD">Declare Your Independence with Ernest Hancock - Radio</font></a></b><br>
						
						<font face="Arial" size="2">Host: <b><a target="_blank" href="Writer-Bio-Page.htm?EditNo=001">
						<font color="#3234CD" face="Arial" size="2">Ernest Hancock</font></a></b></font><br>
						<a href="http://www.FreedomsPhoenix.com/Media/156925-2014-06-04-06-04-14-dave-hodges-video-mp3-loaded.htm">
						<b><font face="Arial" size="4" color="#3234CD">06-04-14 -- Dave Hodges - (VIDEO & MP3 LOADED)</font></b></a><br>
						<font face="Arial" size="2">Program Date:&nbsp; <b>2014-06-04</b></font><br>
						<font face="Arial" size="2">&nbsp;&nbsp; Dave Hodges (TheCommonSenseShow.Com) Has Not Left the Building. Contrary to popular belief, Dave Hodges has not left the building. Here is the story and more...</font></td>
					</tr>
					<tr>
						<td width="456" colspan="7" bgcolor="#D7EBFF" style="border-top-style: none; border-top-width: medium; border-bottom-style: solid; border-bottom-width: 1" align="center">
						<a target="_blank" href="Add-Comment.htm?EdNo=001&Type=Media&Info=156925">
						<img border="0" src="../images/Buttons/Make-a-Comment.gif" width="81" height="11"></a>
						<font face="Arial" size="2" color="#3234CD">�</font>
						<a href="/Email-Story.htm?EdNo=001&Info=0278779">
						<img border="0" src="../images/Buttons/Email-Link.gif" width="57" height="11"></a>
						<font face="Arial" size="2" color="#3234CD">�</font>
						<a target="_blank" href="Add-Letter.htm?EdNo=001&Info=0278779">
						<img border="0" src="../images/Buttons/Send-Letter-to-Editor.gif" width="92" height="11"></a>
						<font face="Arial" size="2" color="#3234CD">�</font>
						<a target="_blank" href="Save-Link.htm?EdNo=001&Info=0278779">
						<img border="0" src="../images/Buttons/Save-Link.gif" width="53" height="11"></a><br>
						</td>
					</tr>
					<tr>
						<td bgcolor="#D7EBFF" style="border-bottom-style: solid; border-bottom-width: 1" colspan="7">
						<img border="0" src="http://www.FreedomsPhoenix.com/images/Media-Logos/Pix/Declare-Your-Independence-with-Ernest-Hancock---Radio-Show-Pix.jpg" hspace="10" width="139" height="100" align="left">
						<font face="Arial" size="1">Radio/TV Show&nbsp; �&nbsp; 
						<b><a target="_blank" href="http://www.FreedomsPhoenix.com/Subjects/00189-LAST-declare-your-independence-with-ernest-hancock.htm">
						<font color="#3234CD">Declare Your Independence with Ernest Hancock</font></a></b></font><br>
						<b>
						<a target="_blank" href="http://www.freedomsphoenix.com/Program-Page.htm?No=0001">
						<font face="Arial" color="#3234CD">Declare Your Independence with Ernest Hancock - Radio</font></a></b><br>
						
						<font face="Arial" size="2">Host: <b><a target="_blank" href="Writer-Bio-Page.htm?EditNo=001">
						<font color="#3234CD" face="Arial" size="2">Ernest Hancock</font></a></b></font><br>
						<a href="http://www.FreedomsPhoenix.com/Media/156868-2014-06-03-06-03-14-freedoms-phoenix-headline-news-gregg-tivnan-video.htm">
						<b><font face="Arial" size="4" color="#3234CD">06-03-14 -- Freedom's Phoenix Headline News - Gregg Tivnan - (VIDEO & MP3 LOADED)</font></b></a><br>
